CREATE EXTENSION sql_saga CASCADE;
NOTICE:  installing required extension "btree_gist"
CREATE TABLE legal_unit (
  id INTEGER,
  valid_after date GENERATED ALWAYS AS (valid_from - INTERVAL '1 day') STORED,
  valid_from date,
  valid_to date,
  name varchar NOT NULL
);
CREATE TABLE location (
  id INTEGER,
  valid_after date GENERATED ALWAYS AS (valid_from - INTERVAL '1 day') STORED,
  valid_from date,
  valid_to date,
  legal_unit_id INTEGER NOT NULL,
  postal_place TEXT NOT NULL
);
-- Before using sql_saga
\d legal_unit
                                                Table "public.legal_unit"
   Column    |       Type        | Collation | Nullable |                             Default                             
-------------+-------------------+-----------+----------+-----------------------------------------------------------------
 id          | integer           |           |          | 
 valid_after | date              |           |          | generated always as ((valid_from - '@ 1 day'::interval)) stored
 valid_from  | date              |           |          | 
 valid_to    | date              |           |          | 
 name        | character varying |           | not null | 

\d location
                                             Table "public.location"
    Column     |  Type   | Collation | Nullable |                             Default                             
---------------+---------+-----------+----------+-----------------------------------------------------------------
 id            | integer |           |          | 
 valid_after   | date    |           |          | generated always as ((valid_from - '@ 1 day'::interval)) stored
 valid_from    | date    |           |          | 
 valid_to      | date    |           |          | 
 legal_unit_id | integer |           | not null | 
 postal_place  | text    |           | not null | 

-- Verify that enable and disable each work correctly.
SELECT sql_saga.add_era('legal_unit', 'valid_after', 'valid_to');
 add_era 
---------
 t
(1 row)

SELECT sql_saga.add_era('location', 'valid_after', 'valid_to');
 add_era 
---------
 t
(1 row)

TABLE sql_saga.era;
 table_name | era_name | start_after_column_name | stop_on_column_name | range_type | bounds_check_constraint | audit_table_name 
------------+----------+-------------------------+---------------------+------------+-------------------------+------------------
 legal_unit | valid    | valid_after             | valid_to            | daterange  | legal_unit_valid_check  | 
 location   | valid    | valid_after             | valid_to            | daterange  | location_valid_check    | 
(2 rows)

SELECT sql_saga.add_unique_key('legal_unit', ARRAY['id'], 'valid');
   add_unique_key    
---------------------
 legal_unit_id_valid
(1 row)

SELECT sql_saga.add_unique_key('location', ARRAY['id'], 'valid');
  add_unique_key   
-------------------
 location_id_valid
(1 row)

TABLE sql_saga.unique_keys;
      key_name       | table_name | column_names | era_name |           unique_constraint            |      exclude_constraint      
---------------------+------------+--------------+----------+----------------------------------------+------------------------------
 legal_unit_id_valid | legal_unit | {id}         | valid    | legal_unit_id_valid_after_valid_to_key | legal_unit_id_daterange_excl
 location_id_valid   | location   | {id}         | valid    | location_id_valid_after_valid_to_key   | location_id_daterange_excl
(2 rows)

SELECT sql_saga.add_foreign_key('location', ARRAY['legal_unit_id'], 'valid', 'legal_unit_id_valid');
       add_foreign_key        
------------------------------
 location_legal_unit_id_valid
(1 row)

TABLE sql_saga.foreign_keys;
           key_name           | table_name |  column_names   | era_name |     unique_key      | match_type | delete_action | update_action |           fk_insert_trigger            |           fk_update_trigger            |           uk_update_trigger            |           uk_delete_trigger            
------------------------------+------------+-----------------+----------+---------------------+------------+---------------+---------------+----------------------------------------+----------------------------------------+----------------------------------------+----------------------------------------
 location_legal_unit_id_valid | location   | {legal_unit_id} | valid    | legal_unit_id_valid | SIMPLE     | NO ACTION     | NO ACTION     | location_legal_unit_id_valid_fk_insert | location_legal_unit_id_valid_fk_update | location_legal_unit_id_valid_uk_update | location_legal_unit_id_valid_uk_delete
(1 row)

-- While sql_saga is active
\d legal_unit
                                                Table "public.legal_unit"
   Column    |       Type        | Collation | Nullable |                             Default                             
-------------+-------------------+-----------+----------+-----------------------------------------------------------------
 id          | integer           |           |          | 
 valid_after | date              |           | not null | generated always as ((valid_from - '@ 1 day'::interval)) stored
 valid_from  | date              |           |          | 
 valid_to    | date              |           | not null | 
 name        | character varying |           | not null | 
Indexes:
    "legal_unit_id_daterange_excl" EXCLUDE USING gist (id WITH =, daterange(valid_after, valid_to, '(]'::text) WITH &&) DEFERRABLE
    "legal_unit_id_valid_after_valid_to_key" UNIQUE CONSTRAINT, btree (id, valid_after, valid_to) DEFERRABLE
Check constraints:
    "legal_unit_valid_check" CHECK (valid_after < valid_to)
Triggers:
    location_legal_unit_id_valid_uk_delete AFTER DELETE ON legal_unit FROM location DEFERRABLE INITIALLY IMMEDIATE FOR EACH ROW EXECUTE FUNCTION sql_saga.uk_delete_check('location_legal_unit_id_valid')
    location_legal_unit_id_valid_uk_update AFTER UPDATE OF id, valid_after, valid_to ON legal_unit FROM location DEFERRABLE INITIALLY IMMEDIATE FOR EACH ROW EXECUTE FUNCTION sql_saga.uk_update_check('location_legal_unit_id_valid')

\d location
                                             Table "public.location"
    Column     |  Type   | Collation | Nullable |                             Default                             
---------------+---------+-----------+----------+-----------------------------------------------------------------
 id            | integer |           |          | 
 valid_after   | date    |           | not null | generated always as ((valid_from - '@ 1 day'::interval)) stored
 valid_from    | date    |           |          | 
 valid_to      | date    |           | not null | 
 legal_unit_id | integer |           | not null | 
 postal_place  | text    |           | not null | 
Indexes:
    "location_id_daterange_excl" EXCLUDE USING gist (id WITH =, daterange(valid_after, valid_to, '(]'::text) WITH &&) DEFERRABLE
    "location_id_valid_after_valid_to_key" UNIQUE CONSTRAINT, btree (id, valid_after, valid_to) DEFERRABLE
Check constraints:
    "location_valid_check" CHECK (valid_after < valid_to)
Triggers:
    location_legal_unit_id_valid_fk_insert AFTER INSERT ON location FROM legal_unit DEFERRABLE INITIALLY IMMEDIATE FOR EACH ROW EXECUTE FUNCTION sql_saga.fk_insert_check('location_legal_unit_id_valid')
    location_legal_unit_id_valid_fk_update AFTER UPDATE OF legal_unit_id, valid_after, valid_to ON location FROM legal_unit DEFERRABLE INITIALLY IMMEDIATE FOR EACH ROW EXECUTE FUNCTION sql_saga.fk_update_check('location_legal_unit_id_valid')

-- Initial Import
INSERT INTO legal_unit (id, valid_from, valid_to, name) VALUES
(101, '2015-01-01', 'infinity', 'NANSETKRYSSET AS');
INSERT INTO location (id, valid_from, valid_to, legal_unit_id, postal_place) VALUES
(201, '2015-01-01', 'infinity',101 , 'DRAMMEN');
TABLE legal_unit;
 id  | valid_after | valid_from | valid_to |       name       
-----+-------------+------------+----------+------------------
 101 | 12-31-2014  | 01-01-2015 | infinity | NANSETKRYSSET AS
(1 row)

TABLE location;
 id  | valid_after | valid_from | valid_to | legal_unit_id | postal_place 
-----+-------------+------------+----------+---------------+--------------
 201 | 12-31-2014  | 01-01-2015 | infinity |           101 | DRAMMEN
(1 row)

-- Can't delete referenced legal_Init
DELETE FROM legal_unit WHERE id = 101;
ERROR:  update or delete on table "legal_unit" violates foreign key constraint "location_legal_unit_id_valid" on table "location"
CONTEXT:  PL/pgSQL function sql_saga.validate_foreign_key_old_row(name,jsonb,boolean) line 136 at RAISE
SQL statement "SELECT sql_saga.validate_foreign_key_old_row(TG_ARGV[0], jold, false)"
PL/pgSQL function sql_saga.uk_delete_check() line 22 at PERFORM
-- Can't shorten referenced legal_unit more than the referencing location
UPDATE legal_unit SET valid_to = '2015-12-31' WHERE id = 101;
ERROR:  update or delete on table "legal_unit" violates foreign key constraint "location_legal_unit_id_valid" on table "location"
CONTEXT:  PL/pgSQL function sql_saga.validate_foreign_key_old_row(name,jsonb,boolean) line 163 at RAISE
SQL statement "SELECT sql_saga.validate_foreign_key_old_row(TG_ARGV[0], jold, true)"
PL/pgSQL function sql_saga.uk_update_check() line 23 at PERFORM
-- With deferred constraints, adjust the data
BEGIN;
SET CONSTRAINTS ALL DEFERRED;
UPDATE legal_unit SET valid_to = '2015-12-31'
WHERE id = 101
  AND valid_from = '2015-01-01'
  AND valid_to = 'infinity';
INSERT INTO legal_unit (id, valid_from, valid_to, name) VALUES
(101, '2016-01-01', 'infinity', 'NANSETVEIEN AS');
TABLE legal_unit;
 id  | valid_after | valid_from |  valid_to  |       name       
-----+-------------+------------+------------+------------------
 101 | 12-31-2014  | 01-01-2015 | 12-31-2015 | NANSETKRYSSET AS
 101 | 12-31-2015  | 01-01-2016 | infinity   | NANSETVEIEN AS
(2 rows)

TABLE location;
 id  | valid_after | valid_from | valid_to | legal_unit_id | postal_place 
-----+-------------+------------+----------+---------------+--------------
 201 | 12-31-2014  | 01-01-2015 | infinity |           101 | DRAMMEN
(1 row)

SET CONSTRAINTS ALL IMMEDIATE;
COMMIT;
TABLE legal_unit;
 id  | valid_after | valid_from |  valid_to  |       name       
-----+-------------+------------+------------+------------------
 101 | 12-31-2014  | 01-01-2015 | 12-31-2015 | NANSETKRYSSET AS
 101 | 12-31-2015  | 01-01-2016 | infinity   | NANSETVEIEN AS
(2 rows)

TABLE location;
 id  | valid_after | valid_from | valid_to | legal_unit_id | postal_place 
-----+-------------+------------+----------+---------------+--------------
 201 | 12-31-2014  | 01-01-2015 | infinity |           101 | DRAMMEN
(1 row)

BEGIN;
SET CONSTRAINTS ALL DEFERRED;
-- The algorithm for *_era changes in stabus will delete the old row
-- and make a new one that replaces it, if they are adjacent.
DELETE FROM location
WHERE id = 201
  AND valid_from = '2015-01-01'
  AND valid_to = 'infinity';
INSERT INTO location (id, valid_from, valid_to, legal_unit_id, postal_place) VALUES
(201, '2015-01-01', 'infinity',101 , 'DRAMMEN');
SET CONSTRAINTS ALL IMMEDIATE;
COMMIT;
TABLE legal_unit;
 id  | valid_after | valid_from |  valid_to  |       name       
-----+-------------+------------+------------+------------------
 101 | 12-31-2014  | 01-01-2015 | 12-31-2015 | NANSETKRYSSET AS
 101 | 12-31-2015  | 01-01-2016 | infinity   | NANSETVEIEN AS
(2 rows)

TABLE location;
 id  | valid_after | valid_from | valid_to | legal_unit_id | postal_place 
-----+-------------+------------+----------+---------------+--------------
 201 | 12-31-2014  | 01-01-2015 | infinity |           101 | DRAMMEN
(1 row)

-- Teardown
SELECT sql_saga.drop_foreign_key('location', 'location_legal_unit_id_valid');
 drop_foreign_key 
------------------
 t
(1 row)

TABLE sql_saga.foreign_keys;
 key_name | table_name | column_names | era_name | unique_key | match_type | delete_action | update_action | fk_insert_trigger | fk_update_trigger | uk_update_trigger | uk_delete_trigger 
----------+------------+--------------+----------+------------+------------+---------------+---------------+-------------------+-------------------+-------------------+-------------------
(0 rows)

SELECT sql_saga.drop_unique_key('legal_unit', 'legal_unit_id_valid');
 drop_unique_key 
-----------------
 
(1 row)

SELECT sql_saga.drop_unique_key('location','location_id_valid');
 drop_unique_key 
-----------------
 
(1 row)

TABLE sql_saga.unique_keys;
 key_name | table_name | column_names | era_name | unique_constraint | exclude_constraint 
----------+------------+--------------+----------+-------------------+--------------------
(0 rows)

SELECT sql_saga.drop_era('legal_unit');
 drop_era 
----------
 t
(1 row)

SELECT sql_saga.drop_era('location');
 drop_era 
----------
 t
(1 row)

TABLE sql_saga.era;
 table_name | era_name | start_after_column_name | stop_on_column_name | range_type | bounds_check_constraint | audit_table_name 
------------+----------+-------------------------+---------------------+------------+-------------------------+------------------
(0 rows)

-- After removing sql_saga, it should be as before.
\d legal_unit
                                                Table "public.legal_unit"
   Column    |       Type        | Collation | Nullable |                             Default                             
-------------+-------------------+-----------+----------+-----------------------------------------------------------------
 id          | integer           |           |          | 
 valid_after | date              |           | not null | generated always as ((valid_from - '@ 1 day'::interval)) stored
 valid_from  | date              |           |          | 
 valid_to    | date              |           | not null | 
 name        | character varying |           | not null | 

\d location
                                             Table "public.location"
    Column     |  Type   | Collation | Nullable |                             Default                             
---------------+---------+-----------+----------+-----------------------------------------------------------------
 id            | integer |           |          | 
 valid_after   | date    |           | not null | generated always as ((valid_from - '@ 1 day'::interval)) stored
 valid_from    | date    |           |          | 
 valid_to      | date    |           | not null | 
 legal_unit_id | integer |           | not null | 
 postal_place  | text    |           | not null | 

DROP TABLE legal_unit;
DROP TABLE location;
DROP EXTENSION sql_saga;
DROP EXTENSION btree_gist;
