CREATE EXTENSION sql_saga CASCADE;
NOTICE:  installing required extension "btree_gist"
CREATE TABLE legal_unit (
  id INTEGER,
  valid_from date,
  valid_until date,
  name varchar NOT NULL
);
CREATE TABLE location (
  id INTEGER,
  valid_from date,
  valid_until date,
  legal_unit_id INTEGER NOT NULL,
  postal_place TEXT NOT NULL
);
-- Before using sql_saga
\d legal_unit
                    Table "public.legal_unit"
   Column    |       Type        | Collation | Nullable | Default 
-------------+-------------------+-----------+----------+---------
 id          | integer           |           |          | 
 valid_from  | date              |           |          | 
 valid_until | date              |           |          | 
 name        | character varying |           | not null | 

\d location
                 Table "public.location"
    Column     |  Type   | Collation | Nullable | Default 
---------------+---------+-----------+----------+---------
 id            | integer |           |          | 
 valid_from    | date    |           |          | 
 valid_until   | date    |           |          | 
 legal_unit_id | integer |           | not null | 
 postal_place  | text    |           | not null | 

-- Verify that enable and disable each work correctly.
SELECT sql_saga.add_era('legal_unit', 'valid_from', 'valid_until');
 add_era 
---------
 t
(1 row)

SELECT sql_saga.add_era('location', 'valid_from', 'valid_until');
 add_era 
---------
 t
(1 row)

TABLE sql_saga.era;
 table_schema | table_name | era_name | valid_from_column_name | valid_until_column_name | range_type | bounds_check_constraint | audit_table_oid 
--------------+------------+----------+------------------------+-------------------------+------------+-------------------------+-----------------
 public       | legal_unit | valid    | valid_from             | valid_until             | daterange  | legal_unit_valid_check  | 
 public       | location   | valid    | valid_from             | valid_until             | daterange  | location_valid_check    | 
(2 rows)

SELECT sql_saga.add_unique_key('legal_unit', ARRAY['id'], 'valid');
   add_unique_key    
---------------------
 legal_unit_id_valid
(1 row)

SELECT sql_saga.add_unique_key('location', ARRAY['id'], 'valid');
  add_unique_key   
-------------------
 location_id_valid
(1 row)

TABLE sql_saga.unique_keys;
   unique_key_name   | table_schema | table_name | column_names | era_name |            unique_constraint             |      exclude_constraint      
---------------------+--------------+------------+--------------+----------+------------------------------------------+------------------------------
 legal_unit_id_valid | public       | legal_unit | {id}         | valid    | legal_unit_id_valid_from_valid_until_key | legal_unit_id_daterange_excl
 location_id_valid   | public       | location   | {id}         | valid    | location_id_valid_from_valid_until_key   | location_id_daterange_excl
(2 rows)

SELECT sql_saga.add_foreign_key('location', ARRAY['legal_unit_id'], 'valid', 'legal_unit_id_valid');
       add_foreign_key        
------------------------------
 location_legal_unit_id_valid
(1 row)

TABLE sql_saga.foreign_keys;
       foreign_key_name       | table_schema | table_name |  column_names   | era_name |   unique_key_name   | match_type | update_action | delete_action |           fk_insert_trigger            |           fk_update_trigger            |           uk_update_trigger            |           uk_delete_trigger            
------------------------------+--------------+------------+-----------------+----------+---------------------+------------+---------------+---------------+----------------------------------------+----------------------------------------+----------------------------------------+----------------------------------------
 location_legal_unit_id_valid | public       | location   | {legal_unit_id} | valid    | legal_unit_id_valid | SIMPLE     | NO ACTION     | NO ACTION     | location_legal_unit_id_valid_fk_insert | location_legal_unit_id_valid_fk_update | location_legal_unit_id_valid_uk_update | location_legal_unit_id_valid_uk_delete
(1 row)

-- While sql_saga is active
\d legal_unit
                    Table "public.legal_unit"
   Column    |       Type        | Collation | Nullable | Default 
-------------+-------------------+-----------+----------+---------
 id          | integer           |           |          | 
 valid_from  | date              |           | not null | 
 valid_until | date              |           | not null | 
 name        | character varying |           | not null | 
Indexes:
    "legal_unit_id_daterange_excl" EXCLUDE USING gist (id WITH =, daterange(valid_from, valid_until) WITH &&) DEFERRABLE
    "legal_unit_id_valid_from_valid_until_key" UNIQUE CONSTRAINT, btree (id, valid_from, valid_until) DEFERRABLE
Check constraints:
    "legal_unit_valid_check" CHECK (valid_from < valid_until)
Triggers:
    location_legal_unit_id_valid_uk_delete AFTER DELETE ON legal_unit FROM location DEFERRABLE INITIALLY IMMEDIATE FOR EACH ROW EXECUTE FUNCTION sql_saga.uk_delete_check_c('location_legal_unit_id_valid', 'public', 'location', '{{legal_unit_id}}', 'valid', 'valid_from', 'valid_until', 'public', 'legal_unit', '{{id}}', 'valid', 'valid_from', 'valid_until', 'SIMPLE', 'NO ACTION', 'NO ACTION')
    location_legal_unit_id_valid_uk_update AFTER UPDATE OF id, valid_from, valid_until ON legal_unit FROM location DEFERRABLE INITIALLY IMMEDIATE FOR EACH ROW EXECUTE FUNCTION sql_saga.uk_update_check_c('location_legal_unit_id_valid', 'public', 'location', '{{legal_unit_id}}', 'valid', 'valid_from', 'valid_until', 'public', 'legal_unit', '{{id}}', 'valid', 'valid_from', 'valid_until', 'SIMPLE', 'NO ACTION', 'NO ACTION')

\d location
                 Table "public.location"
    Column     |  Type   | Collation | Nullable | Default 
---------------+---------+-----------+----------+---------
 id            | integer |           |          | 
 valid_from    | date    |           | not null | 
 valid_until   | date    |           | not null | 
 legal_unit_id | integer |           | not null | 
 postal_place  | text    |           | not null | 
Indexes:
    "location_id_daterange_excl" EXCLUDE USING gist (id WITH =, daterange(valid_from, valid_until) WITH &&) DEFERRABLE
    "location_id_valid_from_valid_until_key" UNIQUE CONSTRAINT, btree (id, valid_from, valid_until) DEFERRABLE
Check constraints:
    "location_valid_check" CHECK (valid_from < valid_until)
Triggers:
    location_legal_unit_id_valid_fk_insert AFTER INSERT ON location FROM legal_unit DEFERRABLE INITIALLY IMMEDIATE FOR EACH ROW EXECUTE FUNCTION sql_saga.fk_insert_check_c('location_legal_unit_id_valid', 'public', 'location', '{{legal_unit_id}}', 'valid', 'valid_from', 'valid_until', 'public', 'legal_unit', '{{id}}', 'valid', 'valid_from', 'valid_until', 'SIMPLE', 'NO ACTION', 'NO ACTION')
    location_legal_unit_id_valid_fk_update AFTER UPDATE OF legal_unit_id, valid_from, valid_until ON location FROM legal_unit DEFERRABLE INITIALLY IMMEDIATE FOR EACH ROW EXECUTE FUNCTION sql_saga.fk_update_check_c('location_legal_unit_id_valid', 'public', 'location', '{{legal_unit_id}}', 'valid', 'valid_from', 'valid_until', 'public', 'legal_unit', '{{id}}', 'valid', 'valid_from', 'valid_until', 'SIMPLE', 'NO ACTION', 'NO ACTION')

-- Initial Import
INSERT INTO legal_unit (id, valid_from, valid_until, name) VALUES
(101, '2015-01-01', 'infinity', 'NANSETKRYSSET AS');
INSERT INTO location (id, valid_from, valid_until, legal_unit_id, postal_place) VALUES
(201, '2015-01-01', 'infinity',101 , 'DRAMMEN');
TABLE legal_unit;
 id  | valid_from | valid_until |       name       
-----+------------+-------------+------------------
 101 | 01-01-2015 | infinity    | NANSETKRYSSET AS
(1 row)

TABLE location;
 id  | valid_from | valid_until | legal_unit_id | postal_place 
-----+------------+-------------+---------------+--------------
 201 | 01-01-2015 | infinity    |           101 | DRAMMEN
(1 row)

-- Can't delete referenced legal_Init
DELETE FROM legal_unit WHERE id = 101;
ERROR:  update or delete on table "public.legal_unit" violates foreign key constraint "location_legal_unit_id_valid" on table "public.location"
-- Can't shorten referenced legal_unit more than the referencing location
UPDATE legal_unit SET valid_until = '2016-01-01' WHERE id = 101;
ERROR:  update or delete on table "public.legal_unit" violates foreign key constraint "location_legal_unit_id_valid" on table "public.location"
-- With deferred constraints, adjust the data
BEGIN;
SET CONSTRAINTS ALL DEFERRED;
UPDATE legal_unit SET valid_until = '2016-01-01'
WHERE id = 101
  AND valid_from = '2015-01-01'
  AND valid_until = 'infinity';
INSERT INTO legal_unit (id, valid_from, valid_until, name) VALUES
(101, '2016-01-01', 'infinity', 'NANSETVEIEN AS');
TABLE legal_unit;
 id  | valid_from | valid_until |       name       
-----+------------+-------------+------------------
 101 | 01-01-2015 | 01-01-2016  | NANSETKRYSSET AS
 101 | 01-01-2016 | infinity    | NANSETVEIEN AS
(2 rows)

TABLE location;
 id  | valid_from | valid_until | legal_unit_id | postal_place 
-----+------------+-------------+---------------+--------------
 201 | 01-01-2015 | infinity    |           101 | DRAMMEN
(1 row)

SET CONSTRAINTS ALL IMMEDIATE;
COMMIT;
TABLE legal_unit;
 id  | valid_from | valid_until |       name       
-----+------------+-------------+------------------
 101 | 01-01-2015 | 01-01-2016  | NANSETKRYSSET AS
 101 | 01-01-2016 | infinity    | NANSETVEIEN AS
(2 rows)

TABLE location;
 id  | valid_from | valid_until | legal_unit_id | postal_place 
-----+------------+-------------+---------------+--------------
 201 | 01-01-2015 | infinity    |           101 | DRAMMEN
(1 row)

BEGIN;
SET CONSTRAINTS ALL DEFERRED;
-- The algorithm for *_era changes in stabus will delete the old row
-- and make a new one that replaces it, if they are adjacent.
DELETE FROM location
WHERE id = 201
  AND valid_from = '2015-01-01'
  AND valid_until = 'infinity';
INSERT INTO location (id, valid_from, valid_until, legal_unit_id, postal_place) VALUES
(201, '2015-01-01', 'infinity',101 , 'DRAMMEN');
SET CONSTRAINTS ALL IMMEDIATE;
COMMIT;
TABLE legal_unit;
 id  | valid_from | valid_until |       name       
-----+------------+-------------+------------------
 101 | 01-01-2015 | 01-01-2016  | NANSETKRYSSET AS
 101 | 01-01-2016 | infinity    | NANSETVEIEN AS
(2 rows)

TABLE location;
 id  | valid_from | valid_until | legal_unit_id | postal_place 
-----+------------+-------------+---------------+--------------
 201 | 01-01-2015 | infinity    |           101 | DRAMMEN
(1 row)

-- Teardown
SELECT sql_saga.drop_foreign_key('location', 'location_legal_unit_id_valid');
 drop_foreign_key 
------------------
 t
(1 row)

TABLE sql_saga.foreign_keys;
 foreign_key_name | table_schema | table_name | column_names | era_name | unique_key_name | match_type | update_action | delete_action | fk_insert_trigger | fk_update_trigger | uk_update_trigger | uk_delete_trigger 
------------------+--------------+------------+--------------+----------+-----------------+------------+---------------+---------------+-------------------+-------------------+-------------------+-------------------
(0 rows)

SELECT sql_saga.drop_unique_key('legal_unit', 'legal_unit_id_valid');
 drop_unique_key 
-----------------
 
(1 row)

SELECT sql_saga.drop_unique_key('location','location_id_valid');
 drop_unique_key 
-----------------
 
(1 row)

TABLE sql_saga.unique_keys;
 unique_key_name | table_schema | table_name | column_names | era_name | unique_constraint | exclude_constraint 
-----------------+--------------+------------+--------------+----------+-------------------+--------------------
(0 rows)

SELECT sql_saga.drop_era('legal_unit');
 drop_era 
----------
 t
(1 row)

SELECT sql_saga.drop_era('location');
 drop_era 
----------
 t
(1 row)

TABLE sql_saga.era;
 table_schema | table_name | era_name | valid_from_column_name | valid_until_column_name | range_type | bounds_check_constraint | audit_table_oid 
--------------+------------+----------+------------------------+-------------------------+------------+-------------------------+-----------------
(0 rows)

-- After removing sql_saga, it should be as before.
\d legal_unit
                    Table "public.legal_unit"
   Column    |       Type        | Collation | Nullable | Default 
-------------+-------------------+-----------+----------+---------
 id          | integer           |           |          | 
 valid_from  | date              |           | not null | 
 valid_until | date              |           | not null | 
 name        | character varying |           | not null | 

\d location
                 Table "public.location"
    Column     |  Type   | Collation | Nullable | Default 
---------------+---------+-----------+----------+---------
 id            | integer |           |          | 
 valid_from    | date    |           | not null | 
 valid_until   | date    |           | not null | 
 legal_unit_id | integer |           | not null | 
 postal_place  | text    |           | not null | 

DROP TABLE legal_unit;
DROP TABLE location;
DROP EXTENSION sql_saga;
DROP EXTENSION btree_gist;
