log_id,event,label,queryid,calls,total_exec_time,rows,shared_blks_hit,shared_blks_read,temp_blks_read,temp_blks_written,total_plan_time,wal_records,wal_bytes,query
465,Temporal Merge 20% INSERT 80% PATCH Child,,-7794985505730227729,1,841.74975,0,81725,0,0,0,0,30057,2980708,"CALL sql_saga.temporal_merge(target_table => 'establishment_tm'::regclass, source_table => 'establishment_source'::regclass, primary_identity_columns => ARRAY['id'], ephemeral_columns => ARRAY[]::TEXT[])"
0c2,Temporal Merge 20% INSERT 80% PATCH Child,,2771726372354210282,1,706.852083,2500,23322,0,0,0,0,5813,627943,"INSERT INTO temporal_merge_plan         SELECT * FROM sql_saga.temporal_merge_plan(             target_table => temporal_merge.target_table,             source_table => temporal_merge.source_table,             mode => temporal_merge.mode,             era_name => temporal_merge.era_name,             identity_columns => v_identity_cols_discovered,             row_id_column => temporal_merge.row_id_column,             founding_id_column => temporal_merge.founding_id_column,             delete_mode => temporal_merge.delete_mode,             lookup_keys => v_natural_identity_keys_discovered,             ephemeral_columns => temporal_merge.ephemeral_columns,             p_log_trace => v_log_trace,             p_log_sql => v_log_sql         )"
dac,Temporal Merge 20% INSERT 80% PATCH Child,,-5503619115560107696,1,384.422125,2000,502,0,0,0,0,137,15757,"CREATE TEMP TABLE existing_segments_with_target ON COMMIT DROP AS                 SELECT                     seg.grouping_key, seg.canonical_nk_json, seg.id, seg.causal_id, seg.is_new_entity, seg.is_identifiable, seg.is_ambiguous, seg.conflicting_ids, seg.stable_identity_columns_are_null, seg.lookup_columns_unavailable, seg.valid_from, seg.valid_until,                     target_row.valid_from as t_valid_from, target_row.valid_until as t_valid_until,                     target_row.data_payload as t_data_payload, target_row.ephemeral_payload as t_ephemeral_payload, seg.stable_pk_payload,                      target_row.stable_pk_payload as target_stable_pk_payload,                     source_payloads.source_row_id, source_payloads.contributing_row_ids,                     source_payloads.data_payload as s_data_payload, source_payloads.ephemeral_payload as s_ephemeral_payload,                     source_payloads.valid_from AS s_valid_from, source_payloads.valid_until AS s_valid_until,                     NULL::jsonb as trace                 FROM atomic_segments seg                 LEFT JOIN target_rows target_row                      ON (target_row.id = seg.id OR (target_row.id IS NULL AND seg.id IS NULL))                      AND daterange(seg.valid_from, seg.valid_until) <@ daterange(target_row.valid_from, target_row.valid_until)                                          LEFT JOIN LATERAL (                             WITH RECURSIVE ordered_sources AS (                                 SELECT                                     source_row.source_row_id, source_row.data_payload, source_row.ephemeral_payload,                                     source_row.valid_from, source_row.valid_until, source_row.causal_id,                                     row_number() OVER (ORDER BY source_row.source_row_id) as rn                                 FROM active_source_rows source_row                                 WHERE (source_row.id = seg.id OR (source_row.id IS NULL AND seg.id IS NULL))                                 AND da"
e81,Temporal Merge 20% INSERT 80% PATCH Child,,8638904705720135180,1,383.68237500000004,2000,350,0,0,0,0,137,15757,"CREATE TEMP TABLE existing_segments_with_target ON COMMIT DROP AS                 SELECT                     seg.grouping_key, seg.canonical_nk_json, seg.id, seg.causal_id, seg.is_new_entity, seg.is_identifiable, seg.is_ambiguous, seg.conflicting_ids, seg.stable_identity_columns_are_null, seg.lookup_columns_unavailable, seg.valid_from, seg.valid_until,                     target_row.valid_from as t_valid_from, target_row.valid_until as t_valid_until,                     target_row.data_payload as t_data_payload, target_row.ephemeral_payload as t_ephemeral_payload, seg.stable_pk_payload,                      target_row.stable_pk_payload as target_stable_pk_payload,                     source_payloads.source_row_id, source_payloads.contributing_row_ids,                     source_payloads.data_payload as s_data_payload, source_payloads.ephemeral_payload as s_ephemeral_payload,                     source_payloads.valid_from AS s_valid_from, source_payloads.valid_until AS s_valid_until,                     NULL::jsonb as trace                 FROM atomic_segments seg                 LEFT JOIN target_rows target_row                      ON (target_row.id = seg.id OR (target_row.id IS NULL AND seg.id IS NULL))                      AND daterange(seg.valid_from, seg.valid_until) <@ daterange(target_row.valid_from, target_row.valid_until)                                          LEFT JOIN LATERAL (                             WITH RECURSIVE ordered_sources AS (                                 SELECT                                     source_row.source_row_id, source_row.data_payload, source_row.ephemeral_payload,                                     source_row.valid_from, source_row.valid_until, source_row.causal_id,                                     row_number() OVER (ORDER BY source_row.source_row_id) as rn                                 FROM active_source_rows source_row                                 WHERE (source_row.id = seg.id OR (source_row.id IS NULL AND seg.id IS NULL))                                 AND da"
83c,Temporal Merge 20% INSERT 80% PATCH Child,,2694921930326277208,1,132.104209,0,57479,0,0,0,0,23978,2328686,"CALL sql_saga.temporal_merge_execute(             target_table => temporal_merge.target_table,             source_table => temporal_merge.source_table,             identity_columns => v_identity_cols_discovered,             mode => temporal_merge.mode,             era_name => temporal_merge.era_name,             row_id_column => temporal_merge.row_id_column,             founding_id_column => temporal_merge.founding_id_column,             update_source_with_identity => temporal_merge.update_source_with_identity,             lookup_columns => v_natural_identity_cols_discovered,             delete_mode => temporal_merge.delete_mode,             update_source_with_feedback => temporal_merge.update_source_with_feedback,             feedback_status_column => temporal_merge.feedback_status_column,             feedback_status_key => temporal_merge.feedback_status_key,             feedback_error_column => temporal_merge.feedback_error_column,             feedback_error_key => temporal_merge.feedback_error_key,             ephemeral_columns => temporal_merge.ephemeral_columns,             delay_constraints => temporal_merge.delay_constraints         )"
b8f,Temporal Merge 20% INSERT 80% PATCH Child,,-8558045933137502344,1,81.62195799999999,2000,44157,0,0,0,0,18108,1764213,"UPDATE establishment_tm t SET valid_range = p.new_valid_range::daterange, legal_unit_id = CASE WHEN p.data ? 'legal_unit_id' THEN (p.data->>'legal_unit_id')::integer ELSE t.legal_unit_id END, postal_place = CASE WHEN p.data ? 'postal_place' THEN (p.data->>'postal_place')::text ELSE t.postal_place END                                 FROM (SELECT *, (entity_keys->>'id')::integer AS id_ek FROM temporal_merge_plan WHERE operation = 'UPDATE' AND statement_seq = 1 ORDER BY plan_op_seq) p                                 WHERE t.id = p.id_ek AND t.valid_range = p.old_valid_range::daterange"
ecf,Temporal Merge 20% INSERT 80% PATCH Child,,0,38,53.17391399999998,0,8559,0,0,0,0,2281,160025,DROP TABLE pg_temp.temporal_merge_plan
ff5,Temporal Merge 20% INSERT 80% PATCH Child,,0,1,26.32,0,5901,0,0,0,0,1614,87156,CALL sql_saga.temporal_merge_drop_temp_tables()
478,Temporal Merge 20% INSERT 80% PATCH Child,,-2046183703977100040,1,21.745042,9000,425,0,0,0,0,118,14029,"CREATE TEMP TABLE time_points_unified ON COMMIT DROP AS                 SELECT                     *,                     CASE                 WHEN is_new_entity                 THEN 'new_entity__' || CASE WHEN canonical_nk_json IS NOT NULL AND canonical_nk_json <> '{}'::jsonb THEN COALESCE(canonical_nk_json->>'id', '_NULL_') ELSE COALESCE(id::text, '_NULL_') END                 ELSE 'existing_entity__' || COALESCE(id::text, '_NULL_')             END AS grouping_key,                     CASE                         WHEN is_new_entity THEN causal_id                         ELSE FIRST_VALUE(causal_id) OVER (PARTITION BY CASE                 WHEN is_new_entity                 THEN 'new_entity__' || CASE WHEN canonical_nk_json IS NOT NULL AND canonical_nk_json <> '{}'::jsonb THEN COALESCE(canonical_nk_json->>'id', '_NULL_') ELSE COALESCE(id::text, '_NULL_') END                 ELSE 'existing_entity__' || COALESCE(id::text, '_NULL_')             END ORDER BY causal_id ASC NULLS LAST)                     END as unified_causal_id,                     FIRST_VALUE(stable_pk_payload) OVER (PARTITION BY CASE                 WHEN is_new_entity                 THEN 'new_entity__' || CASE WHEN canonical_nk_json IS NOT NULL AND canonical_nk_json <> '{}'::jsonb THEN COALESCE(canonical_nk_json->>'id', '_NULL_') ELSE COALESCE(id::text, '_NULL_') END                 ELSE 'existing_entity__' || COALESCE(id::text, '_NULL_')             END ORDER BY causal_id ASC NULLS FIRST) as unified_stable_pk_payload,                     FIRST_VALUE(canonical_nk_json) OVER (PARTITION BY CASE                 WHEN is_new_entity                 THEN 'new_entity__' || CASE WHEN canonical_nk_json IS NOT NULL AND canonical_nk_json <> '{}'::jsonb THEN COALESCE(canonical_nk_json->>'id', '_NULL_') ELSE COALESCE(id::text, '_NULL_') END                 ELSE 'existing_entity__' || COALESCE(id::text, '_NULL_')             END ORDER BY causal_id ASC NULLS FIRST) as unified_canonical_nk_json                 FROM time_points_raw"
70d,Temporal Merge 20% INSERT 80% PATCH Child,,5813186476201306677,1,21.303625,9000,313,0,0,0,0,118,14029,"CREATE TEMP TABLE time_points_unified ON COMMIT DROP AS                 SELECT                     *,                     CASE                 WHEN is_new_entity                 THEN 'new_entity__' || CASE WHEN canonical_nk_json IS NOT NULL AND canonical_nk_json <> '{}'::jsonb THEN COALESCE(canonical_nk_json->>'id', '_NULL_') ELSE COALESCE(id::text, '_NULL_') END                 ELSE 'existing_entity__' || COALESCE(id::text, '_NULL_')             END AS grouping_key,                     CASE                         WHEN is_new_entity THEN causal_id                         ELSE FIRST_VALUE(causal_id) OVER (PARTITION BY CASE                 WHEN is_new_entity                 THEN 'new_entity__' || CASE WHEN canonical_nk_json IS NOT NULL AND canonical_nk_json <> '{}'::jsonb THEN COALESCE(canonical_nk_json->>'id', '_NULL_') ELSE COALESCE(id::text, '_NULL_') END                 ELSE 'existing_entity__' || COALESCE(id::text, '_NULL_')             END ORDER BY causal_id ASC NULLS LAST)                     END as unified_causal_id,                     FIRST_VALUE(stable_pk_payload) OVER (PARTITION BY CASE                 WHEN is_new_entity                 THEN 'new_entity__' || CASE WHEN canonical_nk_json IS NOT NULL AND canonical_nk_json <> '{}'::jsonb THEN COALESCE(canonical_nk_json->>'id', '_NULL_') ELSE COALESCE(id::text, '_NULL_') END                 ELSE 'existing_entity__' || COALESCE(id::text, '_NULL_')             END ORDER BY causal_id ASC NULLS FIRST) as unified_stable_pk_payload,                     FIRST_VALUE(canonical_nk_json) OVER (PARTITION BY CASE                 WHEN is_new_entity                 THEN 'new_entity__' || CASE WHEN canonical_nk_json IS NOT NULL AND canonical_nk_json <> '{}'::jsonb THEN COALESCE(canonical_nk_json->>'id', '_NULL_') ELSE COALESCE(id::text, '_NULL_') END                 ELSE 'existing_entity__' || COALESCE(id::text, '_NULL_')             END ORDER BY causal_id ASC NULLS FIRST) as unified_canonical_nk_json                 FROM time_points_raw"
3c0,Temporal Merge 20% INSERT 80% PATCH Child,,-8259425963603516266,1,18.395625,0,247,0,0,0,0,57,17615,ANALYZE resolved_atomic_segments_with_payloads
614,Temporal Merge 20% INSERT 80% PATCH Child,,4003948963102765198,1,18.28775,2500,497,0,0,0,0,131,14768,"CREATE TEMP TABLE coalesced_final_segments ON COMMIT DROP AS                 SELECT                     grouping_key, max(id) as id,                     sql_saga.first(causal_id ORDER BY valid_from) as causal_id,                     sql_saga.first(stable_identity_columns_are_null ORDER BY valid_from) as stable_identity_columns_are_null,                     sql_saga.first(lookup_columns_unavailable ORDER BY valid_from) as lookup_columns_unavailable,                     sql_saga.first(is_new_entity ORDER BY valid_from) as is_new_entity,                     sql_saga.first(is_identifiable ORDER BY valid_from) as is_identifiable,                     sql_saga.first(is_ambiguous ORDER BY valid_from) as is_ambiguous,                     sql_saga.first(conflicting_ids ORDER BY valid_from) as conflicting_ids,                     sql_saga.first(unified_canonical_nk_json ORDER BY valid_from) as canonical_nk_json,                     sql_saga.first(orig_source_target_relation ORDER BY valid_from) as orig_source_target_relation,                     sql_saga.first(t_valid_from ORDER BY valid_from) as ancestor_valid_from,                     MIN(valid_from) as valid_from,                     MAX(valid_until) as valid_until,                     (sql_saga.first(data_payload ORDER BY valid_from DESC) || sql_saga.first(ephemeral_payload ORDER BY valid_from DESC)) as final_payload,                     sql_saga.first(stable_pk_payload ORDER BY valid_from DESC) as stable_pk_payload,                     bool_and(unaffected_target_only_segment) as unaffected_target_only_segment,                     (SELECT array_agg(DISTINCT e) FROM unnest(array_concat_agg(causal_source_row_ids)) e WHERE e IS NOT NULL) as row_ids,                     CASE WHEN 'f'::boolean                         THEN jsonb_build_object( 'cte', 'coalesced', 'island_group_id', island_group_id, 'coalesced_stable_pk', sql_saga.first(stable_pk_payload ORDER BY valid_from DESC), 'final_payload', sql_saga.first(data_payload ORDER BY valid_from DESC), 'final_payload_sans_epheme"
ea1,Temporal Merge 20% INSERT 80% PATCH Child,,7935349751127421217,1,17.723875,2500,341,0,0,0,0,131,14768,"CREATE TEMP TABLE coalesced_final_segments ON COMMIT DROP AS                 SELECT                     grouping_key, max(id) as id,                     sql_saga.first(causal_id ORDER BY valid_from) as causal_id,                     sql_saga.first(stable_identity_columns_are_null ORDER BY valid_from) as stable_identity_columns_are_null,                     sql_saga.first(lookup_columns_unavailable ORDER BY valid_from) as lookup_columns_unavailable,                     sql_saga.first(is_new_entity ORDER BY valid_from) as is_new_entity,                     sql_saga.first(is_identifiable ORDER BY valid_from) as is_identifiable,                     sql_saga.first(is_ambiguous ORDER BY valid_from) as is_ambiguous,                     sql_saga.first(conflicting_ids ORDER BY valid_from) as conflicting_ids,                     sql_saga.first(unified_canonical_nk_json ORDER BY valid_from) as canonical_nk_json,                     sql_saga.first(orig_source_target_relation ORDER BY valid_from) as orig_source_target_relation,                     sql_saga.first(t_valid_from ORDER BY valid_from) as ancestor_valid_from,                     MIN(valid_from) as valid_from,                     MAX(valid_until) as valid_until,                     (sql_saga.first(data_payload ORDER BY valid_from DESC) || sql_saga.first(ephemeral_payload ORDER BY valid_from DESC)) as final_payload,                     sql_saga.first(stable_pk_payload ORDER BY valid_from DESC) as stable_pk_payload,                     bool_and(unaffected_target_only_segment) as unaffected_target_only_segment,                     (SELECT array_agg(DISTINCT e) FROM unnest(array_concat_agg(causal_source_row_ids)) e WHERE e IS NOT NULL) as row_ids,                     CASE WHEN 'f'::boolean                         THEN jsonb_build_object( 'cte', 'coalesced', 'island_group_id', island_group_id, 'coalesced_stable_pk', sql_saga.first(stable_pk_payload ORDER BY valid_from DESC), 'final_payload', sql_saga.first(data_payload ORDER BY valid_from DESC), 'final_payload_sans_epheme"
e4a,Temporal Merge 20% INSERT 80% PATCH Child,,5562684388977599629,1,17.574125,2500,557,0,0,0,0,155,19164,"CREATE TEMP TABLE resolved_atomic_segments_with_propagated_ids ON COMMIT DROP AS                 SELECT                     *,                     FIRST_VALUE(canonical_nk_json) OVER (PARTITION BY grouping_key ORDER BY valid_from) as unified_canonical_nk_json,                     COALESCE(                         contributing_row_ids,                         (array_concat_agg(contributing_row_ids) FILTER (WHERE contributing_row_ids IS NOT NULL) OVER (PARTITION BY grouping_key, t_valid_from, look_behind_grp)),                         (array_concat_agg(contributing_row_ids) FILTER (WHERE contributing_row_ids IS NOT NULL) OVER (PARTITION BY grouping_key, t_valid_from, look_ahead_grp))                     ) as causal_source_row_ids,                     COALESCE(                         s_valid_from,                         (max(s_valid_from) OVER (PARTITION BY grouping_key, t_valid_from, look_behind_grp)),                         (max(s_valid_from) OVER (PARTITION BY grouping_key, t_valid_from, look_ahead_grp))                     ) as propagated_s_valid_from,                     COALESCE(                         s_valid_until,                         (max(s_valid_until) OVER (PARTITION BY grouping_key, t_valid_from, look_behind_grp)),                         (max(s_valid_until) OVER (PARTITION BY grouping_key, t_valid_from, look_ahead_grp))                     ) as propagated_s_valid_until                 FROM (                     SELECT                         *,                         sum(CASE WHEN source_row_id IS NOT NULL THEN 1 ELSE 0 END) OVER (PARTITION BY grouping_key, t_valid_from ORDER BY valid_from) AS look_behind_grp,                         sum(CASE WHEN source_row_id IS NOT NULL THEN 1 ELSE 0 END) OVER (PARTITION BY grouping_key, t_valid_from ORDER BY valid_from DESC) AS look_ahead_grp                     FROM resolved_atomic_segments_with_payloads /* v_resolver_from */                 ) with_grp"
614,Temporal Merge 20% INSERT 80% PATCH Child,,-7430754555525448296,1,16.946292000000003,2500,383,0,0,0,0,154,19106,"CREATE TEMP TABLE resolved_atomic_segments_with_propagated_ids ON COMMIT DROP AS                 SELECT                     *,                     FIRST_VALUE(canonical_nk_json) OVER (PARTITION BY grouping_key ORDER BY valid_from) as unified_canonical_nk_json,                     COALESCE(                         contributing_row_ids,                         (array_concat_agg(contributing_row_ids) FILTER (WHERE contributing_row_ids IS NOT NULL) OVER (PARTITION BY grouping_key, t_valid_from, look_behind_grp)),                         (array_concat_agg(contributing_row_ids) FILTER (WHERE contributing_row_ids IS NOT NULL) OVER (PARTITION BY grouping_key, t_valid_from, look_ahead_grp))                     ) as causal_source_row_ids,                     COALESCE(                         s_valid_from,                         (max(s_valid_from) OVER (PARTITION BY grouping_key, t_valid_from, look_behind_grp)),                         (max(s_valid_from) OVER (PARTITION BY grouping_key, t_valid_from, look_ahead_grp))                     ) as propagated_s_valid_from,                     COALESCE(                         s_valid_until,                         (max(s_valid_until) OVER (PARTITION BY grouping_key, t_valid_from, look_behind_grp)),                         (max(s_valid_until) OVER (PARTITION BY grouping_key, t_valid_from, look_ahead_grp))                     ) as propagated_s_valid_until                 FROM (                     SELECT                         *,                         sum(CASE WHEN source_row_id IS NOT NULL THEN 1 ELSE 0 END) OVER (PARTITION BY grouping_key, t_valid_from ORDER BY valid_from) AS look_behind_grp,                         sum(CASE WHEN source_row_id IS NOT NULL THEN 1 ELSE 0 END) OVER (PARTITION BY grouping_key, t_valid_from ORDER BY valid_from DESC) AS look_ahead_grp                     FROM resolved_atomic_segments_with_payloads /* v_resolver_from */                 ) with_grp"
f23,Temporal Merge 20% INSERT 80% PATCH Child,,5501643496507824220,1,13.697208,500,11547,0,0,0,0,5520,521068,"WITH founding_plan_ops AS (                                     SELECT DISTINCT ON (p.grouping_key)                                         p.plan_op_seq,                                         p.causal_id,                                         p.grouping_key,                                         p.new_valid_range,                                         p.entity_keys || p.data as full_data                                     FROM temporal_merge_plan p                                     WHERE p.operation = 'INSERT' AND p.is_new_entity                                     ORDER BY p.grouping_key, p.plan_op_seq                                 ),                                 id_map_cte AS (                                     MERGE INTO establishment_tm t                                     USING founding_plan_ops s ON false                                     WHEN NOT MATCHED THEN                                         INSERT (id, legal_unit_id, postal_place, valid_range)                                         VALUES ((s.full_data->>'id')::integer, (s.full_data->>'legal_unit_id')::integer, (s.full_data->>'postal_place')::text, s.new_valid_range::daterange)                                     RETURNING t.*, s.causal_id, s.grouping_key                                 )                                 INSERT INTO temporal_merge_entity_id_map (grouping_key, causal_id, new_entity_keys)                                 SELECT                                     ir.grouping_key,                                     ir.causal_id,                                     jsonb_build_object('id', ir.id)                                 FROM id_map_cte ir"
72f,Temporal Merge 20% INSERT 80% PATCH Child,,-5685077514497051452,1,13.067417,0,243,0,0,0,0,55,16886,ANALYZE existing_segments_with_target
b28,Temporal Merge 20% INSERT 80% PATCH Child,,4494928315034638917,1,12.826291,2500,518,0,0,0,0,151,17494,"CREATE TEMP TABLE island_group ON COMMIT DROP AS                 SELECT                     *,                     SUM(is_island_start) OVER (PARTITION BY grouping_key ORDER BY valid_from) as island_group_id                 FROM (                     SELECT                         *,                         CASE                             WHEN prev_valid_until IS NULL                             OR prev_valid_until <> valid_from                             OR (prev_data_hash IS DISTINCT FROM data_hash)                             THEN 1                             ELSE 0                         END as is_island_start                     FROM (                         SELECT                             *,                             LAG(valid_until) OVER w as prev_valid_until,                             LAG(data_hash) OVER w as prev_data_hash,                             LAG(data_payload) OVER w as prev_data_payload                         FROM resolved_atomic_segments ras                         WHERE ras.data_payload IS NOT NULL                         WINDOW w AS (PARTITION BY grouping_key ORDER BY valid_from)                     ) s1                 ) s2"
97f,Temporal Merge 20% INSERT 80% PATCH Child,,-2675794321567617346,1,12.252958,2500,376,0,0,0,0,151,17494,"CREATE TEMP TABLE island_group ON COMMIT DROP AS                 SELECT                     *,                     SUM(is_island_start) OVER (PARTITION BY grouping_key ORDER BY valid_from) as island_group_id                 FROM (                     SELECT                         *,                         CASE                             WHEN prev_valid_until IS NULL                             OR prev_valid_until <> valid_from                             OR (prev_data_hash IS DISTINCT FROM data_hash)                             THEN 1                             ELSE 0                         END as is_island_start                     FROM (                         SELECT                             *,                             LAG(valid_until) OVER w as prev_valid_until,                             LAG(data_hash) OVER w as prev_data_hash,                             LAG(data_payload) OVER w as prev_data_payload                         FROM resolved_atomic_segments ras                         WHERE ras.data_payload IS NOT NULL                         WINDOW w AS (PARTITION BY grouping_key ORDER BY valid_from)                     ) s1                 ) s2"
