log_id,event,label,queryid,calls,total_exec_time,rows,shared_blks_hit,shared_blks_read,temp_blks_read,temp_blks_written,total_plan_time,wal_records,wal_bytes,query
4d5,Temporal Merge 20% INSERT 80% PATCH Child,,-2689089957436008130,1,11.309,2500,513,0,0,0,0,142,16250,"CREATE TEMP TABLE resolved_atomic_segments ON COMMIT DROP AS                 SELECT                     grouping_key, id,  stable_identity_columns_are_null, lookup_columns_unavailable, is_new_entity, is_identifiable, is_ambiguous, conflicting_ids, unified_canonical_nk_json,                     valid_from, valid_until, t_valid_from, t_valid_until, propagated_s_valid_from, propagated_s_valid_until, causal_source_row_ids, causal_id, propagated_stable_pk_payload as stable_pk_payload,                     causal_source_row_ids IS NULL AS unaffected_target_only_segment,                     s_data_payload, t_data_payload,                     sql_saga.get_allen_relation(propagated_s_valid_from, propagated_s_valid_until, t_valid_from, t_valid_until) AS orig_source_target_relation,                     COALESCE(t_data_payload, '{}'::jsonb) || COALESCE(s_data_payload, '{}'::jsonb) as data_payload,                     md5((jsonb_strip_nulls(COALESCE(t_data_payload, '{}'::jsonb) || COALESCE(s_data_payload, '{}'::jsonb)))::text) as data_hash,                     CASE                          WHEN s_data_payload IS NULL THEN t_ephemeral_payload                         ELSE COALESCE(t_ephemeral_payload, '{}'::jsonb) || COALESCE(s_ephemeral_payload, '{}'::jsonb)                     END as ephemeral_payload,                     CASE WHEN 'f'::boolean                         THEN trace || jsonb_build_object( 'cte', 'ras', 'segment_stable_pk', propagated_stable_pk_payload, 'final_data_payload', COALESCE(t_data_payload, '{}'::jsonb) || COALESCE(s_data_payload, '{}'::jsonb), 'final_ephemeral_payload', CASE WHEN s_data_payload IS NULL THEN t_ephemeral_payload ELSE COALESCE(t_ephemeral_payload, '{}'::jsonb) || COALESCE(s_ephemeral_payload, '{}'::jsonb) END )                         ELSE NULL                     END as trace                 FROM resolved_atomic_segments_with_propagated_ids"
745,Temporal Merge 20% INSERT 80% PATCH Child,,5432145740772416088,1,11.155417,0,211,0,0,0,0,48,12231,ANALYZE active_source_rows
f2f,Temporal Merge 20% INSERT 80% PATCH Child,,4784271495020545282,1,10.996542,2500,0,0,0,0,0,0,0,"WITH RECURSIVE ordered_plan AS (                     SELECT                         row_number() OVER ( ORDER BY p.grouping_key, p.id, CASE p.operation WHEN 'DELETE' THEN 1 WHEN 'UPDATE' THEN 2 WHEN 'INSERT' THEN 3 ELSE 4 END, p.update_effect NULLS FIRST, CASE WHEN p.update_effect = 'MOVE' THEN 1 ELSE 0 END, CASE WHEN p.update_effect = 'MOVE' THEN COALESCE(p.old_valid_from, p.new_valid_from) END DESC NULLS LAST, COALESCE(p.old_valid_from, p.new_valid_from), (p.row_ids[1]) )::BIGINT as plan_op_seq,                         p.*                     FROM plan p                 ),                 -- For MOVE operations, group into the largest possible batches that can execute together.                 -- Within a single UPDATE statement, all rows see the pre-update state (MVCC snapshot).                 -- So if MOVE A's new_range overlaps MOVE B's old_range, they cannot be in the same statement.                 --                 -- Algorithm: Process MOVEs in plan_op_seq order (which is old_valid_from DESC).                 -- Track a multirange of old_ranges in the current batch. For each MOVE:                 -- - If new_range overlaps the batch's multirange, start a new batch                 -- - Add this MOVE's old_range to the batch's multirange                 --                 -- We use a recursive CTE to accumulate the multirange with reset-on-conflict logic.                 moves_ordered AS (                     SELECT                         o.plan_op_seq,                         o.grouping_key,                         o.old_valid_from,                         o.old_valid_until,                         o.new_valid_from,                         o.new_valid_until,                         row_number() OVER (PARTITION BY o.grouping_key ORDER BY o.plan_op_seq) AS move_seq                     FROM ordered_plan o                     WHERE o.operation = 'UPDATE' AND o.update_effect = 'MOVE'                 ),                 moves_with_batch AS (                     -- Base case: first MOVE in each entity starts b"
899,Temporal Merge 20% INSERT 80% PATCH Child,,8458463611242819755,1,10.702125,2500,359,0,0,0,0,142,16250,"CREATE TEMP TABLE resolved_atomic_segments ON COMMIT DROP AS                 SELECT                     grouping_key, id,  stable_identity_columns_are_null, lookup_columns_unavailable, is_new_entity, is_identifiable, is_ambiguous, conflicting_ids, unified_canonical_nk_json,                     valid_from, valid_until, t_valid_from, t_valid_until, propagated_s_valid_from, propagated_s_valid_until, causal_source_row_ids, causal_id, propagated_stable_pk_payload as stable_pk_payload,                     causal_source_row_ids IS NULL AS unaffected_target_only_segment,                     s_data_payload, t_data_payload,                     sql_saga.get_allen_relation(propagated_s_valid_from, propagated_s_valid_until, t_valid_from, t_valid_until) AS orig_source_target_relation,                     COALESCE(t_data_payload, '{}'::jsonb) || COALESCE(s_data_payload, '{}'::jsonb) as data_payload,                     md5((jsonb_strip_nulls(COALESCE(t_data_payload, '{}'::jsonb) || COALESCE(s_data_payload, '{}'::jsonb)))::text) as data_hash,                     CASE                          WHEN s_data_payload IS NULL THEN t_ephemeral_payload                         ELSE COALESCE(t_ephemeral_payload, '{}'::jsonb) || COALESCE(s_ephemeral_payload, '{}'::jsonb)                     END as ephemeral_payload,                     CASE WHEN 'f'::boolean                         THEN trace || jsonb_build_object( 'cte', 'ras', 'segment_stable_pk', propagated_stable_pk_payload, 'final_data_payload', COALESCE(t_data_payload, '{}'::jsonb) || COALESCE(s_data_payload, '{}'::jsonb), 'final_ephemeral_payload', CASE WHEN s_data_payload IS NULL THEN t_ephemeral_payload ELSE COALESCE(t_ephemeral_payload, '{}'::jsonb) || COALESCE(s_ephemeral_payload, '{}'::jsonb) END )                         ELSE NULL                     END as trace                 FROM resolved_atomic_segments_with_propagated_ids"
2d5,Temporal Merge 20% INSERT 80% PATCH Child,,725758841111022991,152,6.652251,152,3830,0,0,0,0,0,0,"EXISTS (         SELECT 1 FROM pg_event_trigger_ddl_commands() ddl         JOIN pg_class c ON c.oid = ddl.objid         JOIN pg_namespace n ON n.oid = c.relnamespace         WHERE EXISTS (SELECT 1 FROM sql_saga.era e WHERE (e.table_schema, e.table_name) = (n.nspname, c.relname))            OR EXISTS (SELECT 1 FROM sql_saga.updatable_view v JOIN pg_class vc ON vc.relname = v.view_name JOIN pg_namespace vn ON vn.oid = vc.relnamespace AND vn.nspname = v.view_schema WHERE vc.oid = c.oid)            -- Also check system_versioning objects (history table, view)            OR EXISTS (SELECT 1 FROM sql_saga.system_versioning sv WHERE (sv.history_schema_name, sv.history_table_name) = (n.nspname, c.relname))            OR EXISTS (SELECT 1 FROM sql_saga.system_versioning sv WHERE (sv.view_schema_name, sv.view_table_name) = (n.nspname, c.relname))     )"
9e4,Temporal Merge 20% INSERT 80% PATCH Child,,3801168477474623637,500,2.1899259999999994,500,2000,0,0,0,0,500,27000,"SELECT 1 FROM (SELECT ""valid_range"" AS r FROM ONLY ""public"".""legal_unit_tm"" x WHERE ""id"" OPERATOR(pg_catalog.=) $1 AND ""valid_range""::pg_catalog.anyrange OPERATOR(pg_catalog.&&) $2::pg_catalog.anyrange FOR KEY SHARE OF x) x1 HAVING   $2::pg_catalog.anyrange OPERATOR(pg_catalog.<@) pg_catalog.range_agg(x1.r)"
630,Temporal Merge 20% INSERT 80% PATCH Child,,1464568031695687146,152,0.5952059999999997,152,51,0,0,0,0,0,0,SELECT array_agg(command_tag)           FROM pg_event_trigger_ddl_commands()
5b5,Temporal Merge 20% INSERT 80% PATCH Child,,8008625629997484951,152,0.2699549999999998,0,0,0,0,0,0,0,0,SELECT * FROM pg_event_trigger_ddl_commands()
2b4,Temporal Merge 20% INSERT 80% PATCH Parent,,-7794985505730227729,1,703.400167,0,71874,0,0,0,0,24981,2556922,"CALL sql_saga.temporal_merge(target_table => 'legal_unit_tm'::regclass, source_table => 'legal_unit_source'::regclass, primary_identity_columns => ARRAY['id'], ephemeral_columns => ARRAY[]::TEXT[])"
690,Temporal Merge 20% INSERT 80% PATCH Parent,,2771726372354210282,1,638.687083,2500,18678,0,0,0,0,4194,538693,"INSERT INTO temporal_merge_plan         SELECT * FROM sql_saga.temporal_merge_plan(             target_table => temporal_merge.target_table,             source_table => temporal_merge.source_table,             mode => temporal_merge.mode,             era_name => temporal_merge.era_name,             identity_columns => v_identity_cols_discovered,             row_id_column => temporal_merge.row_id_column,             founding_id_column => temporal_merge.founding_id_column,             delete_mode => temporal_merge.delete_mode,             lookup_keys => v_natural_identity_keys_discovered,             ephemeral_columns => temporal_merge.ephemeral_columns,             p_log_trace => v_log_trace,             p_log_sql => v_log_sql         )"
5a8,Temporal Merge 20% INSERT 80% PATCH Parent,,-5503619115560107696,1,372.020834,2000,512,0,0,0,0,138,16933,"CREATE TEMP TABLE existing_segments_with_target ON COMMIT DROP AS                 SELECT                     seg.grouping_key, seg.canonical_nk_json, seg.id, seg.causal_id, seg.is_new_entity, seg.is_identifiable, seg.is_ambiguous, seg.conflicting_ids, seg.stable_identity_columns_are_null, seg.lookup_columns_unavailable, seg.valid_from, seg.valid_until,                     target_row.valid_from as t_valid_from, target_row.valid_until as t_valid_until,                     target_row.data_payload as t_data_payload, target_row.ephemeral_payload as t_ephemeral_payload, seg.stable_pk_payload,                      target_row.stable_pk_payload as target_stable_pk_payload,                     source_payloads.source_row_id, source_payloads.contributing_row_ids,                     source_payloads.data_payload as s_data_payload, source_payloads.ephemeral_payload as s_ephemeral_payload,                     source_payloads.valid_from AS s_valid_from, source_payloads.valid_until AS s_valid_until,                     NULL::jsonb as trace                 FROM atomic_segments seg                 LEFT JOIN target_rows target_row                      ON (target_row.id = seg.id OR (target_row.id IS NULL AND seg.id IS NULL))                      AND daterange(seg.valid_from, seg.valid_until) <@ daterange(target_row.valid_from, target_row.valid_until)                                          LEFT JOIN LATERAL (                             WITH RECURSIVE ordered_sources AS (                                 SELECT                                     source_row.source_row_id, source_row.data_payload, source_row.ephemeral_payload,                                     source_row.valid_from, source_row.valid_until, source_row.causal_id,                                     row_number() OVER (ORDER BY source_row.source_row_id) as rn                                 FROM active_source_rows source_row                                 WHERE (source_row.id = seg.id OR (source_row.id IS NULL AND seg.id IS NULL))                                 AND da"
2eb,Temporal Merge 20% INSERT 80% PATCH Parent,,8638904705720135180,1,371.306334,2000,347,0,0,0,0,138,16933,"CREATE TEMP TABLE existing_segments_with_target ON COMMIT DROP AS                 SELECT                     seg.grouping_key, seg.canonical_nk_json, seg.id, seg.causal_id, seg.is_new_entity, seg.is_identifiable, seg.is_ambiguous, seg.conflicting_ids, seg.stable_identity_columns_are_null, seg.lookup_columns_unavailable, seg.valid_from, seg.valid_until,                     target_row.valid_from as t_valid_from, target_row.valid_until as t_valid_until,                     target_row.data_payload as t_data_payload, target_row.ephemeral_payload as t_ephemeral_payload, seg.stable_pk_payload,                      target_row.stable_pk_payload as target_stable_pk_payload,                     source_payloads.source_row_id, source_payloads.contributing_row_ids,                     source_payloads.data_payload as s_data_payload, source_payloads.ephemeral_payload as s_ephemeral_payload,                     source_payloads.valid_from AS s_valid_from, source_payloads.valid_until AS s_valid_until,                     NULL::jsonb as trace                 FROM atomic_segments seg                 LEFT JOIN target_rows target_row                      ON (target_row.id = seg.id OR (target_row.id IS NULL AND seg.id IS NULL))                      AND daterange(seg.valid_from, seg.valid_until) <@ daterange(target_row.valid_from, target_row.valid_until)                                          LEFT JOIN LATERAL (                             WITH RECURSIVE ordered_sources AS (                                 SELECT                                     source_row.source_row_id, source_row.data_payload, source_row.ephemeral_payload,                                     source_row.valid_from, source_row.valid_until, source_row.causal_id,                                     row_number() OVER (ORDER BY source_row.source_row_id) as rn                                 FROM active_source_rows source_row                                 WHERE (source_row.id = seg.id OR (source_row.id IS NULL AND seg.id IS NULL))                                 AND da"
48a,Temporal Merge 20% INSERT 80% PATCH Parent,,2694921930326277208,1,62.459542,0,51848,0,0,0,0,20608,1998738,"CALL sql_saga.temporal_merge_execute(             target_table => temporal_merge.target_table,             source_table => temporal_merge.source_table,             identity_columns => v_identity_cols_discovered,             mode => temporal_merge.mode,             era_name => temporal_merge.era_name,             row_id_column => temporal_merge.row_id_column,             founding_id_column => temporal_merge.founding_id_column,             update_source_with_identity => temporal_merge.update_source_with_identity,             lookup_columns => v_natural_identity_cols_discovered,             delete_mode => temporal_merge.delete_mode,             update_source_with_feedback => temporal_merge.update_source_with_feedback,             feedback_status_column => temporal_merge.feedback_status_column,             feedback_status_key => temporal_merge.feedback_status_key,             feedback_error_column => temporal_merge.feedback_error_column,             feedback_error_key => temporal_merge.feedback_error_key,             ephemeral_columns => temporal_merge.ephemeral_columns,             delay_constraints => temporal_merge.delay_constraints         )"
2fc,Temporal Merge 20% INSERT 80% PATCH Parent,,-8055440308499042838,1,23.393333,2000,40198,0,0,0,0,16103,1557253,"UPDATE legal_unit_tm t SET valid_range = p.new_valid_range::daterange, name = CASE WHEN p.data ? 'name' THEN (p.data->>'name')::character varying ELSE t.name END                                 FROM (SELECT *, (entity_keys->>'id')::integer AS id_ek FROM temporal_merge_plan WHERE operation = 'UPDATE' AND statement_seq = 1 ORDER BY plan_op_seq) p                                 WHERE t.id = p.id_ek AND t.valid_range = p.old_valid_range::daterange"
f65,Temporal Merge 20% INSERT 80% PATCH Parent,,-2046183703977100040,1,22.122208,9000,397,0,0,0,0,118,13241,"CREATE TEMP TABLE time_points_unified ON COMMIT DROP AS                 SELECT                     *,                     CASE                 WHEN is_new_entity                 THEN 'new_entity__' || CASE WHEN canonical_nk_json IS NOT NULL AND canonical_nk_json <> '{}'::jsonb THEN COALESCE(canonical_nk_json->>'id', '_NULL_') ELSE COALESCE(id::text, '_NULL_') END                 ELSE 'existing_entity__' || COALESCE(id::text, '_NULL_')             END AS grouping_key,                     CASE                         WHEN is_new_entity THEN causal_id                         ELSE FIRST_VALUE(causal_id) OVER (PARTITION BY CASE                 WHEN is_new_entity                 THEN 'new_entity__' || CASE WHEN canonical_nk_json IS NOT NULL AND canonical_nk_json <> '{}'::jsonb THEN COALESCE(canonical_nk_json->>'id', '_NULL_') ELSE COALESCE(id::text, '_NULL_') END                 ELSE 'existing_entity__' || COALESCE(id::text, '_NULL_')             END ORDER BY causal_id ASC NULLS LAST)                     END as unified_causal_id,                     FIRST_VALUE(stable_pk_payload) OVER (PARTITION BY CASE                 WHEN is_new_entity                 THEN 'new_entity__' || CASE WHEN canonical_nk_json IS NOT NULL AND canonical_nk_json <> '{}'::jsonb THEN COALESCE(canonical_nk_json->>'id', '_NULL_') ELSE COALESCE(id::text, '_NULL_') END                 ELSE 'existing_entity__' || COALESCE(id::text, '_NULL_')             END ORDER BY causal_id ASC NULLS FIRST) as unified_stable_pk_payload,                     FIRST_VALUE(canonical_nk_json) OVER (PARTITION BY CASE                 WHEN is_new_entity                 THEN 'new_entity__' || CASE WHEN canonical_nk_json IS NOT NULL AND canonical_nk_json <> '{}'::jsonb THEN COALESCE(canonical_nk_json->>'id', '_NULL_') ELSE COALESCE(id::text, '_NULL_') END                 ELSE 'existing_entity__' || COALESCE(id::text, '_NULL_')             END ORDER BY causal_id ASC NULLS FIRST) as unified_canonical_nk_json                 FROM time_points_raw"
6ca,Temporal Merge 20% INSERT 80% PATCH Parent,,0,10,21.770166,0,3625,0,0,0,0,719,86391,"CREATE TEMP TABLE temporal_merge_plan (LIKE sql_saga.temporal_merge_plan, PRIMARY KEY (plan_op_seq)) ON COMMIT DROP"
2a6,Temporal Merge 20% INSERT 80% PATCH Parent,,5813186476201306677,1,21.671499999999998,9000,303,0,0,0,0,118,13241,"CREATE TEMP TABLE time_points_unified ON COMMIT DROP AS                 SELECT                     *,                     CASE                 WHEN is_new_entity                 THEN 'new_entity__' || CASE WHEN canonical_nk_json IS NOT NULL AND canonical_nk_json <> '{}'::jsonb THEN COALESCE(canonical_nk_json->>'id', '_NULL_') ELSE COALESCE(id::text, '_NULL_') END                 ELSE 'existing_entity__' || COALESCE(id::text, '_NULL_')             END AS grouping_key,                     CASE                         WHEN is_new_entity THEN causal_id                         ELSE FIRST_VALUE(causal_id) OVER (PARTITION BY CASE                 WHEN is_new_entity                 THEN 'new_entity__' || CASE WHEN canonical_nk_json IS NOT NULL AND canonical_nk_json <> '{}'::jsonb THEN COALESCE(canonical_nk_json->>'id', '_NULL_') ELSE COALESCE(id::text, '_NULL_') END                 ELSE 'existing_entity__' || COALESCE(id::text, '_NULL_')             END ORDER BY causal_id ASC NULLS LAST)                     END as unified_causal_id,                     FIRST_VALUE(stable_pk_payload) OVER (PARTITION BY CASE                 WHEN is_new_entity                 THEN 'new_entity__' || CASE WHEN canonical_nk_json IS NOT NULL AND canonical_nk_json <> '{}'::jsonb THEN COALESCE(canonical_nk_json->>'id', '_NULL_') ELSE COALESCE(id::text, '_NULL_') END                 ELSE 'existing_entity__' || COALESCE(id::text, '_NULL_')             END ORDER BY causal_id ASC NULLS FIRST) as unified_stable_pk_payload,                     FIRST_VALUE(canonical_nk_json) OVER (PARTITION BY CASE                 WHEN is_new_entity                 THEN 'new_entity__' || CASE WHEN canonical_nk_json IS NOT NULL AND canonical_nk_json <> '{}'::jsonb THEN COALESCE(canonical_nk_json->>'id', '_NULL_') ELSE COALESCE(id::text, '_NULL_') END                 ELSE 'existing_entity__' || COALESCE(id::text, '_NULL_')             END ORDER BY causal_id ASC NULLS FIRST) as unified_canonical_nk_json                 FROM time_points_raw"
cdf,Temporal Merge 20% INSERT 80% PATCH Parent,,-8259425963603516266,1,17.71675,0,239,0,0,0,0,57,16889,ANALYZE resolved_atomic_segments_with_payloads
0cc,Temporal Merge 20% INSERT 80% PATCH Parent,,4003948963102765198,1,15.639834,2500,475,0,0,0,0,127,14354,"CREATE TEMP TABLE coalesced_final_segments ON COMMIT DROP AS                 SELECT                     grouping_key, max(id) as id,                     sql_saga.first(causal_id ORDER BY valid_from) as causal_id,                     sql_saga.first(stable_identity_columns_are_null ORDER BY valid_from) as stable_identity_columns_are_null,                     sql_saga.first(lookup_columns_unavailable ORDER BY valid_from) as lookup_columns_unavailable,                     sql_saga.first(is_new_entity ORDER BY valid_from) as is_new_entity,                     sql_saga.first(is_identifiable ORDER BY valid_from) as is_identifiable,                     sql_saga.first(is_ambiguous ORDER BY valid_from) as is_ambiguous,                     sql_saga.first(conflicting_ids ORDER BY valid_from) as conflicting_ids,                     sql_saga.first(unified_canonical_nk_json ORDER BY valid_from) as canonical_nk_json,                     sql_saga.first(orig_source_target_relation ORDER BY valid_from) as orig_source_target_relation,                     sql_saga.first(t_valid_from ORDER BY valid_from) as ancestor_valid_from,                     MIN(valid_from) as valid_from,                     MAX(valid_until) as valid_until,                     (sql_saga.first(data_payload ORDER BY valid_from DESC) || sql_saga.first(ephemeral_payload ORDER BY valid_from DESC)) as final_payload,                     sql_saga.first(stable_pk_payload ORDER BY valid_from DESC) as stable_pk_payload,                     bool_and(unaffected_target_only_segment) as unaffected_target_only_segment,                     (SELECT array_agg(DISTINCT e) FROM unnest(array_concat_agg(causal_source_row_ids)) e WHERE e IS NOT NULL) as row_ids,                     CASE WHEN 'f'::boolean                         THEN jsonb_build_object( 'cte', 'coalesced', 'island_group_id', island_group_id, 'coalesced_stable_pk', sql_saga.first(stable_pk_payload ORDER BY valid_from DESC), 'final_payload', sql_saga.first(data_payload ORDER BY valid_from DESC), 'final_payload_sans_epheme"
509,Temporal Merge 20% INSERT 80% PATCH Parent,,5562684388977599629,1,15.53275,2500,549,0,0,0,0,153,21318,"CREATE TEMP TABLE resolved_atomic_segments_with_propagated_ids ON COMMIT DROP AS                 SELECT                     *,                     FIRST_VALUE(canonical_nk_json) OVER (PARTITION BY grouping_key ORDER BY valid_from) as unified_canonical_nk_json,                     COALESCE(                         contributing_row_ids,                         (array_concat_agg(contributing_row_ids) FILTER (WHERE contributing_row_ids IS NOT NULL) OVER (PARTITION BY grouping_key, t_valid_from, look_behind_grp)),                         (array_concat_agg(contributing_row_ids) FILTER (WHERE contributing_row_ids IS NOT NULL) OVER (PARTITION BY grouping_key, t_valid_from, look_ahead_grp))                     ) as causal_source_row_ids,                     COALESCE(                         s_valid_from,                         (max(s_valid_from) OVER (PARTITION BY grouping_key, t_valid_from, look_behind_grp)),                         (max(s_valid_from) OVER (PARTITION BY grouping_key, t_valid_from, look_ahead_grp))                     ) as propagated_s_valid_from,                     COALESCE(                         s_valid_until,                         (max(s_valid_until) OVER (PARTITION BY grouping_key, t_valid_from, look_behind_grp)),                         (max(s_valid_until) OVER (PARTITION BY grouping_key, t_valid_from, look_ahead_grp))                     ) as propagated_s_valid_until                 FROM (                     SELECT                         *,                         sum(CASE WHEN source_row_id IS NOT NULL THEN 1 ELSE 0 END) OVER (PARTITION BY grouping_key, t_valid_from ORDER BY valid_from) AS look_behind_grp,                         sum(CASE WHEN source_row_id IS NOT NULL THEN 1 ELSE 0 END) OVER (PARTITION BY grouping_key, t_valid_from ORDER BY valid_from DESC) AS look_ahead_grp                     FROM resolved_atomic_segments_with_payloads /* v_resolver_from */                 ) with_grp"
