log_id,event,label,queryid,calls,total_exec_time,rows,shared_blks_hit,shared_blks_read,temp_blks_read,temp_blks_written,total_plan_time,wal_records,wal_bytes,query
ec5,Temporal Merge 20% INSERT 80% PATCH Child,,2111835532894669216,1,554.875625,0,129184,0,0,0,0,27099,2564538,"CALL sql_saga.temporal_merge(target_table => 'establishment_tm'::regclass, source_table => 'establishment_source'::regclass, primary_identity_columns => ARRAY['id'], ephemeral_columns => ARRAY[]::TEXT[])"
430,Temporal Merge 20% INSERT 80% PATCH Child,,-4812112147178469803,1,495.84229200000004,2500,70104,0,0,0,0,5450,567070,"INSERT INTO temporal_merge_plan     SELECT * FROM sql_saga.temporal_merge_plan(         target_table => temporal_merge.target_table,         source_table => temporal_merge.source_table,         mode => temporal_merge.mode,         era_name => temporal_merge.era_name,         identity_columns => v_identity_cols_discovered,         row_id_column => temporal_merge.row_id_column,         founding_id_column => temporal_merge.founding_id_column,         delete_mode => temporal_merge.delete_mode,         lookup_keys => v_natural_identity_keys_discovered,         ephemeral_columns => temporal_merge.ephemeral_columns,         p_log_trace => v_log_trace,         p_log_sql => v_log_sql     )"
d24,Temporal Merge 20% INSERT 80% PATCH Child,,-2164500867967520742,1,197.244583,2500,433,0,0,0,0,118,16940,"CREATE TEMP TABLE source_with_eclipsed_flag ON COMMIT DROP AS                 SELECT                     s1.*,                     eclipse_info.is_eclipsed,                     eclipse_info.eclipsed_by                 FROM source_initial s1                 CROSS JOIN LATERAL (                     SELECT                         -- OPTIMIZATION: Use pre-computed valid_range instead of repeated daterange() calls                         -- Combined with composite index, this provides 30-40 percent total performance improvement                         COALESCE(sql_saga.covers_without_gaps(s2.valid_range, s1.valid_range ORDER BY s2.valid_from), false) as is_eclipsed,                         array_agg(s2.source_row_id) as eclipsed_by                     FROM source_initial s2                     WHERE                         (                             (NOT s1.lookup_columns_unavailable AND (s1.id IS NOT DISTINCT FROM s2.id))                             OR                             (s1.lookup_columns_unavailable AND s1.causal_id = s2.causal_id)                         )                         AND                         -- Only consider newer rows (higher row_id) as potential eclipsers.                         s2.source_row_id > s1.source_row_id                 ) eclipse_info"
cb8,Temporal Merge 20% INSERT 80% PATCH Child,,7097502106389416784,1,196.74016699999999,2500,316,0,0,0,0,118,16940,"CREATE TEMP TABLE source_with_eclipsed_flag ON COMMIT DROP AS                 SELECT                     s1.*,                     eclipse_info.is_eclipsed,                     eclipse_info.eclipsed_by                 FROM source_initial s1                 CROSS JOIN LATERAL (                     SELECT                         -- OPTIMIZATION: Use pre-computed valid_range instead of repeated daterange() calls                         -- Combined with composite index, this provides 30-40 percent total performance improvement                         COALESCE(sql_saga.covers_without_gaps(s2.valid_range, s1.valid_range ORDER BY s2.valid_from), false) as is_eclipsed,                         array_agg(s2.source_row_id) as eclipsed_by                     FROM source_initial s2                     WHERE                         (                             (NOT s1.lookup_columns_unavailable AND (s1.id IS NOT DISTINCT FROM s2.id))                             OR                             (s1.lookup_columns_unavailable AND s1.causal_id = s2.causal_id)                         )                         AND                         -- Only consider newer rows (higher row_id) as potential eclipsers.                         s2.source_row_id > s1.source_row_id                 ) eclipse_info;"
db2,Temporal Merge 20% INSERT 80% PATCH Child,,-2936202239505492871,1,56.550459,0,58210,0,0,0,0,21407,1974443,"CALL sql_saga.temporal_merge_execute(         target_table => temporal_merge.target_table,         source_table => temporal_merge.source_table,         identity_columns => v_identity_cols_discovered,         mode => temporal_merge.mode,         era_name => temporal_merge.era_name,         row_id_column => temporal_merge.row_id_column,         founding_id_column => temporal_merge.founding_id_column,         update_source_with_identity => temporal_merge.update_source_with_identity,         lookup_columns => v_natural_identity_cols_discovered,         delete_mode => temporal_merge.delete_mode,         update_source_with_feedback => temporal_merge.update_source_with_feedback,         feedback_status_column => temporal_merge.feedback_status_column,         feedback_status_key => temporal_merge.feedback_status_key,         feedback_error_column => temporal_merge.feedback_error_column,         feedback_error_key => temporal_merge.feedback_error_key,         ephemeral_columns => temporal_merge.ephemeral_columns,         delay_constraints => temporal_merge.delay_constraints     )"
5cf,Temporal Merge 20% INSERT 80% PATCH Child,,938093246872844266,1,39.451541,2000,49449,0,0,0,0,102,11171,"CREATE TEMP TABLE target_rows ON COMMIT DROP AS                 SELECT                     id,  /* v_non_temporal_lookup_cols_select_list_no_alias_prefix */ -- (non-temporal identity columns)                     lower(t.valid_range) as valid_from, -- The temporal identity column (e.g., valid_from)                     NULL::integer /* v_causal_column_type */ as causal_id, -- Target rows do not originate from a source row, so causal_id is NULL. Type is introspected.                     jsonb_build_object('id', id) /* v_stable_pk_cols_jsonb_build_bare */ as stable_pk_payload,                     upper(t.valid_range) as valid_until,                     jsonb_build_object('legal_unit_id', legal_unit_id, 'postal_place', postal_place) /* v_target_data_cols_jsonb_build_bare */ AS data_payload,                     jsonb_build_object() /* v_target_ephemeral_cols_jsonb_build_bare */ AS ephemeral_payload,                     jsonb_strip_nulls(jsonb_build_object('id', t.id)) /* v_target_nk_json_expr */ AS canonical_nk_json                 FROM (                         SELECT * FROM (                             SELECT DISTINCT ON (u.id, u.valid_range) * FROM (                                 (                                         SELECT DISTINCT ON (inner_t.id, inner_t.valid_range) inner_t.*                                         FROM establishment_tm inner_t                                         JOIN (SELECT DISTINCT si.id FROM source_initial si) AS si ON ((si.id = inner_t.id OR (si.id IS NULL AND inner_t.id IS NULL)))                                     )                             ) u                         )                     ) AS t  /* v_target_rows_filter */"
928,Temporal Merge 20% INSERT 80% PATCH Child,,-452145526644945551,1,38.726583000000005,2000,49276,0,0,0,0,102,11171,"CREATE TEMP TABLE target_rows ON COMMIT DROP AS                 SELECT                     id,  /* v_non_temporal_lookup_cols_select_list_no_alias_prefix */ -- (non-temporal identity columns)                     lower(t.valid_range) as valid_from, -- The temporal identity column (e.g., valid_from)                     NULL::integer /* v_causal_column_type */ as causal_id, -- Target rows do not originate from a source row, so causal_id is NULL. Type is introspected.                     jsonb_build_object('id', id) /* v_stable_pk_cols_jsonb_build_bare */ as stable_pk_payload,                     upper(t.valid_range) as valid_until,                     jsonb_build_object('legal_unit_id', legal_unit_id, 'postal_place', postal_place) /* v_target_data_cols_jsonb_build_bare */ AS data_payload,                     jsonb_build_object() /* v_target_ephemeral_cols_jsonb_build_bare */ AS ephemeral_payload,                     jsonb_strip_nulls(jsonb_build_object('id', t.id)) /* v_target_nk_json_expr */ AS canonical_nk_json                 FROM (                         SELECT * FROM (                             SELECT DISTINCT ON (u.id, u.valid_range) * FROM (                                 (                                         SELECT DISTINCT ON (inner_t.id, inner_t.valid_range) inner_t.*                                         FROM establishment_tm inner_t                                         JOIN (SELECT DISTINCT si.id FROM source_initial si) AS si ON ((si.id = inner_t.id OR (si.id IS NULL AND inner_t.id IS NULL)))                                     )                             ) u                         )                     ) AS t  /* v_target_rows_filter */"
c84,Temporal Merge 20% INSERT 80% PATCH Child,,5289330290645012060,1,30.456875,2000,46138,0,0,0,0,16089,1483493,"UPDATE establishment_tm t SET valid_range = p.new_valid_range::daterange, legal_unit_id = CASE WHEN p.data ? 'legal_unit_id' THEN (p.data->>'legal_unit_id')::integer ELSE t.legal_unit_id END, postal_place = CASE WHEN p.data ? 'postal_place' THEN (p.data->>'postal_place')::text ELSE t.postal_place END                                 FROM (SELECT *, (entity_keys->>'id')::integer AS id_ek FROM temporal_merge_plan WHERE operation = 'UPDATE' AND statement_seq = 1 ORDER BY plan_op_seq) p                                 WHERE t.id = p.id_ek AND t.valid_range = p.old_valid_range::daterange"
7e0,Temporal Merge 20% INSERT 80% PATCH Child,,0,37,26.486831999999996,0,8016,0,0,0,0,2114,138756,DROP TABLE pg_temp.temporal_merge_plan
12c,Temporal Merge 20% INSERT 80% PATCH Child,,-2046183703977100040,1,22.435333,9000,410,0,0,0,0,117,13999,"CREATE TEMP TABLE time_points_unified ON COMMIT DROP AS                 SELECT                     *,                     CASE                 WHEN is_new_entity                 THEN 'new_entity__' || CASE WHEN canonical_nk_json IS NOT NULL AND canonical_nk_json <> '{}'::jsonb THEN COALESCE(canonical_nk_json->>'id', '_NULL_') ELSE COALESCE(id::text, '_NULL_') END                 ELSE 'existing_entity__' || COALESCE(id::text, '_NULL_')             END AS grouping_key,                     CASE                         WHEN is_new_entity THEN causal_id                         ELSE FIRST_VALUE(causal_id) OVER (PARTITION BY CASE                 WHEN is_new_entity                 THEN 'new_entity__' || CASE WHEN canonical_nk_json IS NOT NULL AND canonical_nk_json <> '{}'::jsonb THEN COALESCE(canonical_nk_json->>'id', '_NULL_') ELSE COALESCE(id::text, '_NULL_') END                 ELSE 'existing_entity__' || COALESCE(id::text, '_NULL_')             END ORDER BY causal_id ASC NULLS LAST)                     END as unified_causal_id,                     FIRST_VALUE(stable_pk_payload) OVER (PARTITION BY CASE                 WHEN is_new_entity                 THEN 'new_entity__' || CASE WHEN canonical_nk_json IS NOT NULL AND canonical_nk_json <> '{}'::jsonb THEN COALESCE(canonical_nk_json->>'id', '_NULL_') ELSE COALESCE(id::text, '_NULL_') END                 ELSE 'existing_entity__' || COALESCE(id::text, '_NULL_')             END ORDER BY causal_id ASC NULLS FIRST) as unified_stable_pk_payload,                     FIRST_VALUE(canonical_nk_json) OVER (PARTITION BY CASE                 WHEN is_new_entity                 THEN 'new_entity__' || CASE WHEN canonical_nk_json IS NOT NULL AND canonical_nk_json <> '{}'::jsonb THEN COALESCE(canonical_nk_json->>'id', '_NULL_') ELSE COALESCE(id::text, '_NULL_') END                 ELSE 'existing_entity__' || COALESCE(id::text, '_NULL_')             END ORDER BY causal_id ASC NULLS FIRST) as unified_canonical_nk_json                 FROM time_points_raw"
261,Temporal Merge 20% INSERT 80% PATCH Child,,5813186476201306677,1,22.019042,9000,309,0,0,0,0,117,13999,"CREATE TEMP TABLE time_points_unified ON COMMIT DROP AS                 SELECT                     *,                     CASE                 WHEN is_new_entity                 THEN 'new_entity__' || CASE WHEN canonical_nk_json IS NOT NULL AND canonical_nk_json <> '{}'::jsonb THEN COALESCE(canonical_nk_json->>'id', '_NULL_') ELSE COALESCE(id::text, '_NULL_') END                 ELSE 'existing_entity__' || COALESCE(id::text, '_NULL_')             END AS grouping_key,                     CASE                         WHEN is_new_entity THEN causal_id                         ELSE FIRST_VALUE(causal_id) OVER (PARTITION BY CASE                 WHEN is_new_entity                 THEN 'new_entity__' || CASE WHEN canonical_nk_json IS NOT NULL AND canonical_nk_json <> '{}'::jsonb THEN COALESCE(canonical_nk_json->>'id', '_NULL_') ELSE COALESCE(id::text, '_NULL_') END                 ELSE 'existing_entity__' || COALESCE(id::text, '_NULL_')             END ORDER BY causal_id ASC NULLS LAST)                     END as unified_causal_id,                     FIRST_VALUE(stable_pk_payload) OVER (PARTITION BY CASE                 WHEN is_new_entity                 THEN 'new_entity__' || CASE WHEN canonical_nk_json IS NOT NULL AND canonical_nk_json <> '{}'::jsonb THEN COALESCE(canonical_nk_json->>'id', '_NULL_') ELSE COALESCE(id::text, '_NULL_') END                 ELSE 'existing_entity__' || COALESCE(id::text, '_NULL_')             END ORDER BY causal_id ASC NULLS FIRST) as unified_stable_pk_payload,                     FIRST_VALUE(canonical_nk_json) OVER (PARTITION BY CASE                 WHEN is_new_entity                 THEN 'new_entity__' || CASE WHEN canonical_nk_json IS NOT NULL AND canonical_nk_json <> '{}'::jsonb THEN COALESCE(canonical_nk_json->>'id', '_NULL_') ELSE COALESCE(id::text, '_NULL_') END                 ELSE 'existing_entity__' || COALESCE(id::text, '_NULL_')             END ORDER BY causal_id ASC NULLS FIRST) as unified_canonical_nk_json                 FROM time_points_raw"
6a1,Temporal Merge 20% INSERT 80% PATCH Child,,0,1,20.282417,0,5659,0,0,0,0,1520,82080,CALL sql_saga.temporal_merge_drop_temp_tables()
18c,Temporal Merge 20% INSERT 80% PATCH Child,,-4045288488008580192,1,17.690291,2500,526,0,0,0,0,140,17255,"CREATE TEMP TABLE resolved_atomic_segments_with_payloads ON COMMIT DROP AS                 WITH all_segments AS (                     SELECT * FROM existing_segments_with_target                     UNION ALL                     SELECT * FROM new_segments_no_target                 )                 SELECT                     with_base_payload.*,                     with_base_payload.stable_pk_payload as propagated_stable_pk_payload                 FROM (                     SELECT                         seg.*, source_payloads.source_row_id, source_payloads.contributing_row_ids,                          source_payloads.data_payload as s_data_payload, source_payloads.ephemeral_payload as s_ephemeral_payload,                         source_payloads.valid_from AS s_valid_from, source_payloads.valid_until AS s_valid_until                     FROM all_segments seg                                              LEFT JOIN LATERAL (                             WITH RECURSIVE ordered_sources AS (                                 SELECT                                     source_row.source_row_id, source_row.data_payload, source_row.ephemeral_payload,                                     source_row.valid_from, source_row.valid_until, source_row.causal_id,                                     row_number() OVER (ORDER BY source_row.source_row_id) as rn                                 FROM active_source_rows source_row                                 WHERE                  ((seg.is_new_entity AND source_row.grouping_key = seg.grouping_key)                 OR                 (NOT seg.is_new_entity AND (source_row.id = seg.id OR (source_row.id IS NULL AND seg.id IS NULL))))              -- v_lateral_join_sr_to_seg                                 AND daterange(seg.valid_from, seg.valid_until) <@ daterange(source_row.valid_from, source_row.valid_until)                             ),                             running_payload AS (                                 SELECT rn, source_row_id, data_payload, ephemeral_payload, valid_from, val"
270,Temporal Merge 20% INSERT 80% PATCH Child,,-5035221965178099237,1,17.074417,2500,353,0,0,0,0,140,17255,"CREATE TEMP TABLE resolved_atomic_segments_with_payloads ON COMMIT DROP AS                 WITH all_segments AS (                     SELECT * FROM existing_segments_with_target                     UNION ALL                     SELECT * FROM new_segments_no_target                 )                 SELECT                     with_base_payload.*,                     with_base_payload.stable_pk_payload as propagated_stable_pk_payload                 FROM (                     SELECT                         seg.*, source_payloads.source_row_id, source_payloads.contributing_row_ids,                          source_payloads.data_payload as s_data_payload, source_payloads.ephemeral_payload as s_ephemeral_payload,                         source_payloads.valid_from AS s_valid_from, source_payloads.valid_until AS s_valid_until                     FROM all_segments seg                                              LEFT JOIN LATERAL (                             WITH RECURSIVE ordered_sources AS (                                 SELECT                                     source_row.source_row_id, source_row.data_payload, source_row.ephemeral_payload,                                     source_row.valid_from, source_row.valid_until, source_row.causal_id,                                     row_number() OVER (ORDER BY source_row.source_row_id) as rn                                 FROM active_source_rows source_row                                 WHERE                  ((seg.is_new_entity AND source_row.grouping_key = seg.grouping_key)                 OR                 (NOT seg.is_new_entity AND (source_row.id = seg.id OR (source_row.id IS NULL AND seg.id IS NULL))))              -- v_lateral_join_sr_to_seg                                 AND daterange(seg.valid_from, seg.valid_until) <@ daterange(source_row.valid_from, source_row.valid_until)                             ),                             running_payload AS (                                 SELECT rn, source_row_id, data_payload, ephemeral_payload, valid_from, val"
f4c,Temporal Merge 20% INSERT 80% PATCH Child,,-2776940750650052835,1,15.808166,2500,505,0,0,0,0,150,17651,"CREATE TEMP TABLE resolved_atomic_segments_with_propagated_ids ON COMMIT DROP AS                 SELECT                     *,                     FIRST_VALUE(canonical_nk_json) OVER (PARTITION BY grouping_key ORDER BY valid_from) as unified_canonical_nk_json,                     COALESCE(                         contributing_row_ids,                         (array_concat_agg(contributing_row_ids) FILTER (WHERE contributing_row_ids IS NOT NULL) OVER (PARTITION BY grouping_key, t_valid_from, look_behind_grp)),                         (array_concat_agg(contributing_row_ids) FILTER (WHERE contributing_row_ids IS NOT NULL) OVER (PARTITION BY grouping_key, t_valid_from, look_ahead_grp))                     ) as causal_source_row_ids,                     COALESCE(                         s_valid_from,                         (max(s_valid_from) OVER (PARTITION BY grouping_key, t_valid_from, look_behind_grp)),                         (max(s_valid_from) OVER (PARTITION BY grouping_key, t_valid_from, look_ahead_grp))                     ) as propagated_s_valid_from,                     COALESCE(                         s_valid_until,                         (max(s_valid_until) OVER (PARTITION BY grouping_key, t_valid_from, look_behind_grp)),                         (max(s_valid_until) OVER (PARTITION BY grouping_key, t_valid_from, look_ahead_grp))                     ) as propagated_s_valid_until                 FROM (                     SELECT                         *,                         sum(CASE WHEN source_row_id IS NOT NULL THEN 1 ELSE 0 END) OVER (PARTITION BY grouping_key, t_valid_from ORDER BY valid_from) AS look_behind_grp,                         sum(CASE WHEN source_row_id IS NOT NULL THEN 1 ELSE 0 END) OVER (PARTITION BY grouping_key, t_valid_from ORDER BY valid_from DESC) AS look_ahead_grp                     FROM resolved_atomic_segments_with_payloads /* v_resolver_from */                 ) with_grp"
690,Temporal Merge 20% INSERT 80% PATCH Child,,1184175690887338237,1,15.654083,2500,484,0,0,0,0,132,22443,"CREATE TEMP TABLE coalesced_final_segments ON COMMIT DROP AS                 SELECT                     grouping_key, max(id) as id,                     sql_saga.first(causal_id ORDER BY valid_from) as causal_id,                     sql_saga.first(stable_identity_columns_are_null ORDER BY valid_from) as stable_identity_columns_are_null,                     sql_saga.first(lookup_columns_unavailable ORDER BY valid_from) as lookup_columns_unavailable,                     sql_saga.first(is_new_entity ORDER BY valid_from) as is_new_entity,                     sql_saga.first(is_identifiable ORDER BY valid_from) as is_identifiable,                     sql_saga.first(is_ambiguous ORDER BY valid_from) as is_ambiguous,                     sql_saga.first(conflicting_ids ORDER BY valid_from) as conflicting_ids,                     sql_saga.first(unified_canonical_nk_json ORDER BY valid_from) as canonical_nk_json,                     sql_saga.first(orig_source_target_relation ORDER BY valid_from) as orig_source_target_relation,                     sql_saga.first(t_valid_from ORDER BY valid_from) as ancestor_valid_from,                     MIN(valid_from) as valid_from,                     MAX(valid_until) as valid_until,                     (sql_saga.first(data_payload ORDER BY valid_from DESC) || sql_saga.first(ephemeral_payload ORDER BY valid_from DESC)) as final_payload,                     sql_saga.first(stable_pk_payload ORDER BY valid_from DESC) as stable_pk_payload,                     bool_and(unaffected_target_only_segment) as unaffected_target_only_segment,                     (SELECT array_agg(DISTINCT e) FROM unnest(array_concat_agg(causal_source_row_ids)) e WHERE e IS NOT NULL) as row_ids,                     CASE WHEN 'f'::boolean                         THEN jsonb_build_object( 'cte', 'coalesced', 'island_group_id', island_group_id, 'coalesced_stable_pk', sql_saga.first(stable_pk_payload ORDER BY valid_from DESC), 'final_payload', sql_saga.first(data_payload ORDER BY valid_from DESC), 'final_payload_sans_epheme"
114,Temporal Merge 20% INSERT 80% PATCH Child,,2489997298867091789,1,15.333959,2500,373,0,0,0,0,150,17651,"CREATE TEMP TABLE resolved_atomic_segments_with_propagated_ids ON COMMIT DROP AS                 SELECT                     *,                     FIRST_VALUE(canonical_nk_json) OVER (PARTITION BY grouping_key ORDER BY valid_from) as unified_canonical_nk_json,                     COALESCE(                         contributing_row_ids,                         (array_concat_agg(contributing_row_ids) FILTER (WHERE contributing_row_ids IS NOT NULL) OVER (PARTITION BY grouping_key, t_valid_from, look_behind_grp)),                         (array_concat_agg(contributing_row_ids) FILTER (WHERE contributing_row_ids IS NOT NULL) OVER (PARTITION BY grouping_key, t_valid_from, look_ahead_grp))                     ) as causal_source_row_ids,                     COALESCE(                         s_valid_from,                         (max(s_valid_from) OVER (PARTITION BY grouping_key, t_valid_from, look_behind_grp)),                         (max(s_valid_from) OVER (PARTITION BY grouping_key, t_valid_from, look_ahead_grp))                     ) as propagated_s_valid_from,                     COALESCE(                         s_valid_until,                         (max(s_valid_until) OVER (PARTITION BY grouping_key, t_valid_from, look_behind_grp)),                         (max(s_valid_until) OVER (PARTITION BY grouping_key, t_valid_from, look_ahead_grp))                     ) as propagated_s_valid_until                 FROM (                     SELECT                         *,                         sum(CASE WHEN source_row_id IS NOT NULL THEN 1 ELSE 0 END) OVER (PARTITION BY grouping_key, t_valid_from ORDER BY valid_from) AS look_behind_grp,                         sum(CASE WHEN source_row_id IS NOT NULL THEN 1 ELSE 0 END) OVER (PARTITION BY grouping_key, t_valid_from ORDER BY valid_from DESC) AS look_ahead_grp                     FROM resolved_atomic_segments_with_payloads /* v_resolver_from */                 ) with_grp"
