log_id,event,label,queryid,calls,total_exec_time,rows,shared_blks_hit,shared_blks_read,temp_blks_read,temp_blks_written,total_plan_time,wal_records,wal_bytes,query
e19,Range-Only Child INSERT,,-1513128718422397264,1,32.033708000000004,1000,19027,0,0,0,0,9032,886672,"INSERT INTO child_range_only (id, valid_range, parent_id, description) SELECT i, daterange('2015-01-01', 'infinity', '[)'), i, 'New Shop ' || i FROM generate_series(10001, 11000) i"
282,Range-Only Child INSERT,,3801168477474623637,1000,6.08937199999999,1000,4000,0,0,0,0,1000,54000,"SELECT 1 FROM (SELECT ""valid_range"" AS r FROM ONLY ""public"".""parent_range_only"" x WHERE ""id"" OPERATOR(pg_catalog.=) $1 AND ""valid_range""::pg_catalog.anyrange OPERATOR(pg_catalog.&&) $2::pg_catalog.anyrange FOR KEY SHARE OF x) x1 HAVING   $2::pg_catalog.anyrange OPERATOR(pg_catalog.<@) pg_catalog.range_agg(x1.r)"
b83,Range-Only Child UPDATE Key,,2032682557053950028,1,28.510875000000002,1000,26068,0,0,0,0,8057,690605,"UPDATE child_range_only SET valid_range = daterange('2014-01-01', upper(valid_range), '[)') WHERE id BETWEEN 1 AND 1000"
f3e,Range-Only Child UPDATE Key,,3801168477474623637,1000,7.14192799999999,1000,6000,0,0,0,0,1009,56740,"SELECT 1 FROM (SELECT ""valid_range"" AS r FROM ONLY ""public"".""parent_range_only"" x WHERE ""id"" OPERATOR(pg_catalog.=) $1 AND ""valid_range""::pg_catalog.anyrange OPERATOR(pg_catalog.&&) $2::pg_catalog.anyrange FOR KEY SHARE OF x) x1 HAVING   $2::pg_catalog.anyrange OPERATOR(pg_catalog.<@) pg_catalog.range_agg(x1.r)"
9a5,Range-Only Child UPDATE Non-Key,,-7180486638484984037,1,12.310458,1000,17669,0,0,0,0,6868,623914,UPDATE child_range_only SET description = 'Updated Shop' WHERE id BETWEEN 1001 AND 2000
14e,Range-Only Parent DELETE (no children),,-4539091173828576470,1,10.7075,1000,4014,0,0,0,0,1000,54000,DELETE FROM parent_range_only WHERE id BETWEEN 20001 AND 21000
52a,Range-Only Parent DELETE (no children),,476854885423386359,1000,2.101572000000002,0,1000,0,0,0,0,0,0,"SELECT 1 FROM ONLY ""public"".""child_range_only"" x WHERE $1 OPERATOR(pg_catalog.=) ""parent_id"" AND $2::pg_catalog.anyrange OPERATOR(pg_catalog.&&) ""valid_range""::pg_catalog.anyrange AND NOT coalesce(  (  ""valid_range""::pg_catalog.anyrange OPERATOR(pg_catalog.*) $2::pg_catalog.anyrange)::pg_catalog.anyrange OPERATOR(pg_catalog.<@) (SELECT pg_catalog.range_agg(r) FROM (SELECT y.""valid_range"" r FROM ONLY ""public"".""parent_range_only"" y WHERE $1 OPERATOR(pg_catalog.=) ""id"" AND $2::pg_catalog.anyrange OPERATOR(pg_catalog.&&) ""valid_range""::pg_catalog.anyrange FOR KEY SHARE OF y) y2), false) FOR KEY SHARE OF x"
cb0,Range-Only Parent INSERT,,6357836274575580935,1,20.087416,1000,12057,0,0,0,0,6024,597904,"INSERT INTO parent_range_only (id, valid_range, name) SELECT i, daterange('2015-01-01', 'infinity', '[)'), 'New Company ' || i FROM generate_series(20001, 21000) i"
19f,Range-Only Parent UPDATE Key,,1252438658754027224,1,40.686458,1000,26154,0,0,0,0,7040,610350,"UPDATE parent_range_only SET valid_range = daterange('2014-01-01', upper(valid_range), '[)') WHERE id BETWEEN 1 AND 1000"
e9c,Range-Only Parent UPDATE Key,,476854885423386359,1000,12.20721499999997,0,8000,0,0,0,0,1000,54000,"SELECT 1 FROM ONLY ""public"".""child_range_only"" x WHERE $1 OPERATOR(pg_catalog.=) ""parent_id"" AND $2::pg_catalog.anyrange OPERATOR(pg_catalog.&&) ""valid_range""::pg_catalog.anyrange AND NOT coalesce(  (  ""valid_range""::pg_catalog.anyrange OPERATOR(pg_catalog.*) $2::pg_catalog.anyrange)::pg_catalog.anyrange OPERATOR(pg_catalog.<@) (SELECT pg_catalog.range_agg(r) FROM (SELECT y.""valid_range"" r FROM ONLY ""public"".""parent_range_only"" y WHERE $1 OPERATOR(pg_catalog.=) ""id"" AND $2::pg_catalog.anyrange OPERATOR(pg_catalog.&&) ""valid_range""::pg_catalog.anyrange FOR KEY SHARE OF y) y2), false) FOR KEY SHARE OF x"
036,Range-Only Parent UPDATE Non-Key,,-7028987207714112929,1,11.862416000000001,1000,15566,0,0,0,0,5835,536792,UPDATE parent_range_only SET name = 'Updated Company' WHERE id BETWEEN 1001 AND 2000
3e3,Range-Only temporal_merge Child,,2468345689813367661,1,354.077958,0,152223,0,0,0,0,11495,1196790,"CALL sql_saga.temporal_merge('child_range_only'::regclass, 'child_source_range_only'::regclass, ARRAY['id'])"
931,Range-Only temporal_merge Child,,-307364665800878133,1,318.580083,1000,128979,0,0,0,0,3930,471527,"INSERT INTO temporal_merge_plan     SELECT * FROM sql_saga.temporal_merge_plan(         target_table => temporal_merge.target_table,         source_table => temporal_merge.source_table,         mode => temporal_merge.mode,         era_name => temporal_merge.era_name,         identity_columns => v_identity_cols_discovered,         row_id_column => temporal_merge.row_id_column,         founding_id_column => temporal_merge.founding_id_column,         delete_mode => temporal_merge.delete_mode,         lookup_keys => v_natural_identity_keys_discovered,         ephemeral_columns => temporal_merge.ephemeral_columns,         p_log_trace => v_log_trace,         p_log_sql => v_log_sql     )"
758,Range-Only temporal_merge Child,,4748073848864616921,1,92.489333,1000,723,0,0,0,0,126,15709,"CREATE TEMP TABLE existing_segments_with_target ON COMMIT DROP AS                 SELECT                     seg.grouping_key, seg.canonical_nk_json, seg.id, seg.causal_id, seg.is_new_entity, seg.is_identifiable, seg.is_ambiguous, seg.conflicting_ids, seg.stable_identity_columns_are_null, seg.lookup_columns_unavailable, seg.valid_from, seg.valid_until,                     target_row.valid_from as t_valid_from, target_row.valid_until as t_valid_until,                     target_row.data_payload as t_data_payload, target_row.ephemeral_payload as t_ephemeral_payload, seg.stable_pk_payload,                      target_row.stable_pk_payload as target_stable_pk_payload,                     NULL::jsonb as trace                 FROM atomic_segments seg                 LEFT JOIN target_rows target_row                      ON (target_row.id = seg.id OR (target_row.id IS NULL AND seg.id IS NULL))                      AND daterange(seg.valid_from, seg.valid_until) <@ daterange(target_row.valid_from, target_row.valid_until)                 WHERE NOT seg.is_new_entity"
5bd,Range-Only temporal_merge Child,,-4685191513584255900,1,91.939875,1000,317,0,0,0,0,126,15709,"CREATE TEMP TABLE existing_segments_with_target ON COMMIT DROP AS                 SELECT                     seg.grouping_key, seg.canonical_nk_json, seg.id, seg.causal_id, seg.is_new_entity, seg.is_identifiable, seg.is_ambiguous, seg.conflicting_ids, seg.stable_identity_columns_are_null, seg.lookup_columns_unavailable, seg.valid_from, seg.valid_until,                     target_row.valid_from as t_valid_from, target_row.valid_until as t_valid_until,                     target_row.data_payload as t_data_payload, target_row.ephemeral_payload as t_ephemeral_payload, seg.stable_pk_payload,                      target_row.stable_pk_payload as target_stable_pk_payload,                     NULL::jsonb as trace                 FROM atomic_segments seg                 LEFT JOIN target_rows target_row                      ON (target_row.id = seg.id OR (target_row.id IS NULL AND seg.id IS NULL))                      AND daterange(seg.valid_from, seg.valid_until) <@ daterange(target_row.valid_from, target_row.valid_until)                 WHERE NOT seg.is_new_entity"
478,Range-Only temporal_merge Child,,938093246872844266,1,76.089125,1000,101774,0,0,0,0,107,11990,"CREATE TEMP TABLE target_rows ON COMMIT DROP AS                 SELECT                     id,  /* v_non_temporal_lookup_cols_select_list_no_alias_prefix */ -- (non-temporal identity columns)                     lower(t.valid_range) as valid_from, -- The temporal identity column (e.g., valid_from)                     NULL::integer /* v_causal_column_type */ as causal_id, -- Target rows do not originate from a source row, so causal_id is NULL. Type is introspected.                     jsonb_build_object('id', id) /* v_stable_pk_cols_jsonb_build_bare */ as stable_pk_payload,                     upper(t.valid_range) as valid_until,                     jsonb_build_object('parent_id', parent_id, 'description', description) /* v_target_data_cols_jsonb_build_bare */ AS data_payload,                     jsonb_build_object() /* v_target_ephemeral_cols_jsonb_build_bare */ AS ephemeral_payload,                     jsonb_strip_nulls(jsonb_build_object('id', t.id)) /* v_target_nk_json_expr */ AS canonical_nk_json                 FROM (                         SELECT * FROM (                             SELECT DISTINCT ON (u.id, u.valid_range) * FROM (                                 (                                         SELECT DISTINCT ON (inner_t.id, inner_t.valid_range) inner_t.*                                         FROM child_range_only inner_t                                         JOIN (SELECT DISTINCT si.id FROM source_initial si) AS si ON ((si.id = inner_t.id OR (si.id IS NULL AND inner_t.id IS NULL)))                                     )                             ) u                         )                     ) AS t  /* v_target_rows_filter */"
cef,Range-Only temporal_merge Child,,-452145526644945551,1,75.25825,1000,101281,0,0,0,0,103,11652,"CREATE TEMP TABLE target_rows ON COMMIT DROP AS                 SELECT                     id,  /* v_non_temporal_lookup_cols_select_list_no_alias_prefix */ -- (non-temporal identity columns)                     lower(t.valid_range) as valid_from, -- The temporal identity column (e.g., valid_from)                     NULL::integer /* v_causal_column_type */ as causal_id, -- Target rows do not originate from a source row, so causal_id is NULL. Type is introspected.                     jsonb_build_object('id', id) /* v_stable_pk_cols_jsonb_build_bare */ as stable_pk_payload,                     upper(t.valid_range) as valid_until,                     jsonb_build_object('parent_id', parent_id, 'description', description) /* v_target_data_cols_jsonb_build_bare */ AS data_payload,                     jsonb_build_object() /* v_target_ephemeral_cols_jsonb_build_bare */ AS ephemeral_payload,                     jsonb_strip_nulls(jsonb_build_object('id', t.id)) /* v_target_nk_json_expr */ AS canonical_nk_json                 FROM (                         SELECT * FROM (                             SELECT DISTINCT ON (u.id, u.valid_range) * FROM (                                 (                                         SELECT DISTINCT ON (inner_t.id, inner_t.valid_range) inner_t.*                                         FROM child_range_only inner_t                                         JOIN (SELECT DISTINCT si.id FROM source_initial si) AS si ON ((si.id = inner_t.id OR (si.id IS NULL AND inner_t.id IS NULL)))                                     )                             ) u                         )                     ) AS t  /* v_target_rows_filter */"
b72,Range-Only temporal_merge Child,,6746233005287271676,1,33.782125,1000,807,0,0,0,0,117,13105,"CREATE TEMP TABLE source_with_eclipsed_flag ON COMMIT DROP AS                 SELECT                     s1.*,                     eclipse_info.is_eclipsed,                     eclipse_info.eclipsed_by                 FROM source_initial s1                 CROSS JOIN LATERAL (                     SELECT                         -- OPTIMIZATION: Use pre-computed valid_range instead of repeated daterange() calls                         -- Combined with composite index, this provides 30-40 percent total performance improvement                         COALESCE(sql_saga.covers_without_gaps(s2.valid_range, s1.valid_range ORDER BY s2.valid_from), false) as is_eclipsed,                         array_agg(s2.source_row_id) as eclipsed_by                     FROM source_initial s2                     WHERE                         (                             (NOT s1.lookup_columns_unavailable AND (s1.id IS NOT DISTINCT FROM s2.id))                             OR                             (s1.lookup_columns_unavailable AND s1.causal_id = s2.causal_id)                         )                         AND                         -- Only consider newer rows (higher row_id) as potential eclipsers.                         s2.source_row_id > s1.source_row_id                 ) eclipse_info"
d30,Range-Only temporal_merge Child,,5254871360229255141,1,33.197207999999996,1000,302,0,0,0,0,117,13105,"CREATE TEMP TABLE source_with_eclipsed_flag ON COMMIT DROP AS                 SELECT                     s1.*,                     eclipse_info.is_eclipsed,                     eclipse_info.eclipsed_by                 FROM source_initial s1                 CROSS JOIN LATERAL (                     SELECT                         -- OPTIMIZATION: Use pre-computed valid_range instead of repeated daterange() calls                         -- Combined with composite index, this provides 30-40 percent total performance improvement                         COALESCE(sql_saga.covers_without_gaps(s2.valid_range, s1.valid_range ORDER BY s2.valid_from), false) as is_eclipsed,                         array_agg(s2.source_row_id) as eclipsed_by                     FROM source_initial s2                     WHERE                         (                             (NOT s1.lookup_columns_unavailable AND (s1.id IS NOT DISTINCT FROM s2.id))                             OR                             (s1.lookup_columns_unavailable AND s1.causal_id = s2.causal_id)                         )                         AND                         -- Only consider newer rows (higher row_id) as potential eclipsers.                         s2.source_row_id > s1.source_row_id                 ) eclipse_info;"
fb5,Range-Only temporal_merge Child,,-7781413691619548832,1,32.837958,0,21735,0,0,0,0,7385,705665,"CALL sql_saga.temporal_merge_execute(         target_table => temporal_merge.target_table,         source_table => temporal_merge.source_table,         identity_columns => v_identity_cols_discovered,         mode => temporal_merge.mode,         era_name => temporal_merge.era_name,         row_id_column => temporal_merge.row_id_column,         founding_id_column => temporal_merge.founding_id_column,         update_source_with_identity => temporal_merge.update_source_with_identity,         lookup_columns => v_natural_identity_cols_discovered,         delete_mode => temporal_merge.delete_mode,         update_source_with_feedback => temporal_merge.update_source_with_feedback,         feedback_status_column => temporal_merge.feedback_status_column,         feedback_status_key => temporal_merge.feedback_status_key,         feedback_error_column => temporal_merge.feedback_error_column,         feedback_error_key => temporal_merge.feedback_error_key,         ephemeral_columns => temporal_merge.ephemeral_columns,         delay_constraints => temporal_merge.delay_constraints     )"
952,Range-Only temporal_merge Child,,-3323908111287156551,1,19.903417,1000,18193,0,0,0,0,7065,660818,"UPDATE child_range_only t SET valid_range = p.new_valid_range::daterange, parent_id = CASE WHEN p.data ? 'parent_id' THEN (p.data->>'parent_id')::integer ELSE t.parent_id END, description = CASE WHEN p.data ? 'description' THEN (p.data->>'description')::text ELSE t.description END                                 FROM (SELECT *, (entity_keys->>'id')::integer AS id_ek FROM temporal_merge_plan WHERE operation = 'UPDATE' AND statement_seq = 1 ORDER BY plan_op_seq) p                                 WHERE t.id = p.id_ek AND t.valid_range = p.old_valid_range::daterange"
6f0,Range-Only temporal_merge Child,,-2046183703977100040,1,10.025792,4000,679,0,0,0,0,116,13077,"CREATE TEMP TABLE time_points_unified ON COMMIT DROP AS                 SELECT                     *,                     CASE                 WHEN is_new_entity                 THEN 'new_entity__' || CASE WHEN canonical_nk_json IS NOT NULL AND canonical_nk_json <> '{}'::jsonb THEN COALESCE(canonical_nk_json->>'id', '_NULL_') ELSE COALESCE(id::text, '_NULL_') END                 ELSE 'existing_entity__' || COALESCE(id::text, '_NULL_')             END AS grouping_key,                     CASE                         WHEN is_new_entity THEN causal_id                         ELSE FIRST_VALUE(causal_id) OVER (PARTITION BY CASE                 WHEN is_new_entity                 THEN 'new_entity__' || CASE WHEN canonical_nk_json IS NOT NULL AND canonical_nk_json <> '{}'::jsonb THEN COALESCE(canonical_nk_json->>'id', '_NULL_') ELSE COALESCE(id::text, '_NULL_') END                 ELSE 'existing_entity__' || COALESCE(id::text, '_NULL_')             END ORDER BY causal_id ASC NULLS LAST)                     END as unified_causal_id,                     FIRST_VALUE(stable_pk_payload) OVER (PARTITION BY CASE                 WHEN is_new_entity                 THEN 'new_entity__' || CASE WHEN canonical_nk_json IS NOT NULL AND canonical_nk_json <> '{}'::jsonb THEN COALESCE(canonical_nk_json->>'id', '_NULL_') ELSE COALESCE(id::text, '_NULL_') END                 ELSE 'existing_entity__' || COALESCE(id::text, '_NULL_')             END ORDER BY causal_id ASC NULLS FIRST) as unified_stable_pk_payload,                     FIRST_VALUE(canonical_nk_json) OVER (PARTITION BY CASE                 WHEN is_new_entity                 THEN 'new_entity__' || CASE WHEN canonical_nk_json IS NOT NULL AND canonical_nk_json <> '{}'::jsonb THEN COALESCE(canonical_nk_json->>'id', '_NULL_') ELSE COALESCE(id::text, '_NULL_') END                 ELSE 'existing_entity__' || COALESCE(id::text, '_NULL_')             END ORDER BY causal_id ASC NULLS FIRST) as unified_canonical_nk_json                 FROM time_points_raw"
496,Range-Only temporal_merge Parent,,2468345689813367661,1,567.860375,0,237074,0,0,0,0,10601,1124072,"CALL sql_saga.temporal_merge('parent_range_only'::regclass, 'parent_source_range_only'::regclass, ARRAY['id'])"
c1a,Range-Only temporal_merge Parent,,-307364665800878133,1,529.158834,1000,216564,0,0,0,0,4051,486115,"INSERT INTO temporal_merge_plan     SELECT * FROM sql_saga.temporal_merge_plan(         target_table => temporal_merge.target_table,         source_table => temporal_merge.source_table,         mode => temporal_merge.mode,         era_name => temporal_merge.era_name,         identity_columns => v_identity_cols_discovered,         row_id_column => temporal_merge.row_id_column,         founding_id_column => temporal_merge.founding_id_column,         delete_mode => temporal_merge.delete_mode,         lookup_keys => v_natural_identity_keys_discovered,         ephemeral_columns => temporal_merge.ephemeral_columns,         p_log_trace => v_log_trace,         p_log_sql => v_log_sql     )"
203,Range-Only temporal_merge Parent,,8304854195670775222,1,165.872625,1000,807,0,0,0,0,139,16029,"CREATE TEMP TABLE resolved_atomic_segments_with_payloads ON COMMIT DROP AS                 WITH all_segments AS (                     SELECT * FROM existing_segments_with_target                     UNION ALL                     SELECT * FROM new_segments_no_target                 )                 SELECT                     with_base_payload.*,                     with_base_payload.stable_pk_payload as propagated_stable_pk_payload                 FROM (                     SELECT                         seg.*, source_payloads.source_row_id, source_payloads.contributing_row_ids,                          source_payloads.data_payload as s_data_payload, source_payloads.ephemeral_payload as s_ephemeral_payload,                         source_payloads.valid_from AS s_valid_from, source_payloads.valid_until AS s_valid_until                     FROM all_segments seg                                              LEFT JOIN LATERAL (                             WITH RECURSIVE ordered_sources AS (                                 SELECT                                     source_row.source_row_id, source_row.data_payload, source_row.ephemeral_payload,                                     source_row.valid_from, source_row.valid_until, source_row.causal_id,                                     row_number() OVER (ORDER BY source_row.source_row_id) as rn                                 FROM active_source_rows source_row                                 WHERE                  ((seg.is_new_entity AND source_row.grouping_key = seg.grouping_key)                 OR                 (NOT seg.is_new_entity AND (source_row.id = seg.id OR (source_row.id IS NULL AND seg.id IS NULL))))              -- v_lateral_join_sr_to_seg                                 AND daterange(seg.valid_from, seg.valid_until) <@ daterange(source_row.valid_from, source_row.valid_until)                             ),                             running_payload AS (                                 SELECT rn, source_row_id, data_payload, ephemeral_payload, valid_from, val"
6d3,Range-Only temporal_merge Parent,,7690776897089114886,1,165.013667,1000,344,0,0,0,0,139,16029,"CREATE TEMP TABLE resolved_atomic_segments_with_payloads ON COMMIT DROP AS                 WITH all_segments AS (                     SELECT * FROM existing_segments_with_target                     UNION ALL                     SELECT * FROM new_segments_no_target                 )                 SELECT                     with_base_payload.*,                     with_base_payload.stable_pk_payload as propagated_stable_pk_payload                 FROM (                     SELECT                         seg.*, source_payloads.source_row_id, source_payloads.contributing_row_ids,                          source_payloads.data_payload as s_data_payload, source_payloads.ephemeral_payload as s_ephemeral_payload,                         source_payloads.valid_from AS s_valid_from, source_payloads.valid_until AS s_valid_until                     FROM all_segments seg                                              LEFT JOIN LATERAL (                             WITH RECURSIVE ordered_sources AS (                                 SELECT                                     source_row.source_row_id, source_row.data_payload, source_row.ephemeral_payload,                                     source_row.valid_from, source_row.valid_until, source_row.causal_id,                                     row_number() OVER (ORDER BY source_row.source_row_id) as rn                                 FROM active_source_rows source_row                                 WHERE                  ((seg.is_new_entity AND source_row.grouping_key = seg.grouping_key)                 OR                 (NOT seg.is_new_entity AND (source_row.id = seg.id OR (source_row.id IS NULL AND seg.id IS NULL))))              -- v_lateral_join_sr_to_seg                                 AND daterange(seg.valid_from, seg.valid_until) <@ daterange(source_row.valid_from, source_row.valid_until)                             ),                             running_payload AS (                                 SELECT rn, source_row_id, data_payload, ephemeral_payload, valid_from, val"
74d,Range-Only temporal_merge Parent,,-5236651202162387398,1,128.239375,1000,189683,0,0,0,0,104,11283,"CREATE TEMP TABLE target_rows ON COMMIT DROP AS                 SELECT                     id,  /* v_non_temporal_lookup_cols_select_list_no_alias_prefix */ -- (non-temporal identity columns)                     lower(t.valid_range) as valid_from, -- The temporal identity column (e.g., valid_from)                     NULL::integer /* v_causal_column_type */ as causal_id, -- Target rows do not originate from a source row, so causal_id is NULL. Type is introspected.                     jsonb_build_object('id', id) /* v_stable_pk_cols_jsonb_build_bare */ as stable_pk_payload,                     upper(t.valid_range) as valid_until,                     jsonb_build_object('name', name) /* v_target_data_cols_jsonb_build_bare */ AS data_payload,                     jsonb_build_object() /* v_target_ephemeral_cols_jsonb_build_bare */ AS ephemeral_payload,                     jsonb_strip_nulls(jsonb_build_object('id', t.id)) /* v_target_nk_json_expr */ AS canonical_nk_json                 FROM (                         SELECT * FROM (                             SELECT DISTINCT ON (u.id, u.valid_range) * FROM (                                 (                                         SELECT DISTINCT ON (inner_t.id, inner_t.valid_range) inner_t.*                                         FROM parent_range_only inner_t                                         JOIN (SELECT DISTINCT si.id FROM source_initial si) AS si ON ((si.id = inner_t.id OR (si.id IS NULL AND inner_t.id IS NULL)))                                     )                             ) u                         )                     ) AS t  /* v_target_rows_filter */"
