log_id,event,label,queryid,calls,total_exec_time,rows,shared_blks_hit,shared_blks_read,temp_blks_read,temp_blks_written,total_plan_time,wal_records,wal_bytes,query
52c,Range-Only Child INSERT,,-1513128718422397264,1,30.656458,1000,17022,0,0,0,0,8027,802472,"INSERT INTO child_range_only (id, valid_range, parent_id, description) SELECT i, daterange('2015-01-01', 'infinity', '[)'), i, 'New Shop ' || i FROM generate_series(10001, 11000) i"
5ae,Range-Only Child INSERT,,3801168477474623637,1000,6.030450999999988,1000,4000,0,0,0,0,1000,54000,"SELECT 1 FROM (SELECT ""valid_range"" AS r FROM ONLY ""public"".""parent_range_only"" x WHERE ""id"" OPERATOR(pg_catalog.=) $1 AND ""valid_range""::pg_catalog.anyrange OPERATOR(pg_catalog.&&) $2::pg_catalog.anyrange FOR KEY SHARE OF x) x1 HAVING   $2::pg_catalog.anyrange OPERATOR(pg_catalog.<@) pg_catalog.range_agg(x1.r)"
bd6,Range-Only Child UPDATE Key,,2032682557053950028,1,26.58475,1000,24050,0,0,0,0,7048,576909,"UPDATE child_range_only SET valid_range = daterange('2014-01-01', upper(valid_range), '[)') WHERE id BETWEEN 1 AND 1000"
16d,Range-Only Child UPDATE Key,,3801168477474623637,1000,7.103256000000009,1000,6000,0,0,0,0,1009,56740,"SELECT 1 FROM (SELECT ""valid_range"" AS r FROM ONLY ""public"".""parent_range_only"" x WHERE ""id"" OPERATOR(pg_catalog.=) $1 AND ""valid_range""::pg_catalog.anyrange OPERATOR(pg_catalog.&&) $2::pg_catalog.anyrange FOR KEY SHARE OF x) x1 HAVING   $2::pg_catalog.anyrange OPERATOR(pg_catalog.<@) pg_catalog.range_agg(x1.r)"
ebb,Range-Only Child UPDATE Non-Key,,-7180486638484984037,1,11.256333,1000,15696,0,0,0,0,5886,512378,UPDATE child_range_only SET description = 'Updated Shop' WHERE id BETWEEN 1001 AND 2000
8eb,Range-Only Parent DELETE (no children),,-4539091173828576470,1,10.356542,1000,4014,0,0,0,0,1000,54000,DELETE FROM parent_range_only WHERE id BETWEEN 20001 AND 21000
d58,Range-Only Parent DELETE (no children),,476854885423386359,1000,2.059063000000007,0,1000,0,0,0,0,0,0,"SELECT 1 FROM ONLY ""public"".""child_range_only"" x WHERE $1 OPERATOR(pg_catalog.=) ""parent_id"" AND $2::pg_catalog.anyrange OPERATOR(pg_catalog.&&) ""valid_range""::pg_catalog.anyrange AND NOT coalesce(  (  ""valid_range""::pg_catalog.anyrange OPERATOR(pg_catalog.*) $2::pg_catalog.anyrange)::pg_catalog.anyrange OPERATOR(pg_catalog.<@) (SELECT pg_catalog.range_agg(r) FROM (SELECT y.""valid_range"" r FROM ONLY ""public"".""parent_range_only"" y WHERE $1 OPERATOR(pg_catalog.=) ""id"" AND $2::pg_catalog.anyrange OPERATOR(pg_catalog.&&) ""valid_range""::pg_catalog.anyrange FOR KEY SHARE OF y) y2), false) FOR KEY SHARE OF x"
5d0,Range-Only Parent INSERT,,6357836274575580935,1,18.954167,1000,10045,0,0,0,0,5018,506576,"INSERT INTO parent_range_only (id, valid_range, name) SELECT i, daterange('2015-01-01', 'infinity', '[)'), 'New Company ' || i FROM generate_series(20001, 21000) i"
fd3,Range-Only Parent UPDATE Key,,1252438658754027224,1,38.130207999999996,1000,24129,0,0,0,0,6031,496654,"UPDATE parent_range_only SET valid_range = daterange('2014-01-01', upper(valid_range), '[)') WHERE id BETWEEN 1 AND 1000"
ad7,Range-Only Parent UPDATE Key,,476854885423386359,1000,11.792379999999968,0,8000,0,0,0,0,1000,54000,"SELECT 1 FROM ONLY ""public"".""child_range_only"" x WHERE $1 OPERATOR(pg_catalog.=) ""parent_id"" AND $2::pg_catalog.anyrange OPERATOR(pg_catalog.&&) ""valid_range""::pg_catalog.anyrange AND NOT coalesce(  (  ""valid_range""::pg_catalog.anyrange OPERATOR(pg_catalog.*) $2::pg_catalog.anyrange)::pg_catalog.anyrange OPERATOR(pg_catalog.<@) (SELECT pg_catalog.range_agg(r) FROM (SELECT y.""valid_range"" r FROM ONLY ""public"".""parent_range_only"" y WHERE $1 OPERATOR(pg_catalog.=) ""id"" AND $2::pg_catalog.anyrange OPERATOR(pg_catalog.&&) ""valid_range""::pg_catalog.anyrange FOR KEY SHARE OF y) y2), false) FOR KEY SHARE OF x"
006,Range-Only Parent UPDATE Non-Key,,-7028987207714112929,1,10.893125,1000,13617,0,0,0,0,4866,433344,UPDATE parent_range_only SET name = 'Updated Company' WHERE id BETWEEN 1001 AND 2000
4ca,Range-Only temporal_merge Child,,7071287273656641802,1,6100.189042,0,828185,0,0,0,0,10158,1039085,"CALL sql_saga.temporal_merge('child_range_only'::regclass, 'child_source_range_only'::regclass, ARRAY['id'])"
df8,Range-Only temporal_merge Child,,-2577546157031926366,1,5617.935625,0,700369,0,0,0,0,6329,567381,"CALL sql_saga.temporal_merge_execute(         target_table => temporal_merge.target_table,         source_table => temporal_merge.source_table,         identity_columns => v_identity_cols_discovered,         mode => temporal_merge.mode,         era_name => temporal_merge.era_name,         row_id_column => temporal_merge.row_id_column,         founding_id_column => temporal_merge.founding_id_column,         update_source_with_identity => temporal_merge.update_source_with_identity,         lookup_columns => v_natural_identity_cols_discovered,         delete_mode => temporal_merge.delete_mode,         update_source_with_feedback => temporal_merge.update_source_with_feedback,         feedback_status_column => temporal_merge.feedback_status_column,         feedback_status_key => temporal_merge.feedback_status_key,         feedback_error_column => temporal_merge.feedback_error_column,         feedback_error_key => temporal_merge.feedback_error_key,         ephemeral_columns => temporal_merge.ephemeral_columns,         delay_constraints => temporal_merge.delay_constraints     )"
880,Range-Only temporal_merge Child,,-1339707654082537555,1,5607.888292000001,1000,697248,0,0,0,0,6059,536853,"UPDATE child_range_only t SET valid_range = daterange(p.new_valid_from::date, p.new_valid_until::date, '[)'), parent_id = CASE WHEN p.data ? 'parent_id' THEN (p.data->>'parent_id')::integer ELSE t.parent_id END, description = CASE WHEN p.data ? 'description' THEN (p.data->>'description')::text ELSE t.description END                                 FROM (SELECT * FROM temporal_merge_plan WHERE operation = 'UPDATE' AND statement_seq = 1 ORDER BY plan_op_seq) p,                                      LATERAL jsonb_populate_record(null::child_range_only, p.entity_keys) AS jpr_entity                                 WHERE (t.id = jpr_entity.id OR (t.id IS NULL AND jpr_entity.id IS NULL)) AND t.valid_range = daterange(p.old_valid_from::date, p.old_valid_until::date, '[)')"
75c,Range-Only temporal_merge Child,,482662322732680403,1,480.104001,1000,126337,0,0,0,0,3654,452846,"INSERT INTO temporal_merge_plan     SELECT * FROM sql_saga.temporal_merge_plan(         target_table => temporal_merge.target_table,         source_table => temporal_merge.source_table,         mode => temporal_merge.mode,         era_name => temporal_merge.era_name,         identity_columns => v_identity_cols_discovered,         row_id_column => temporal_merge.row_id_column,         founding_id_column => temporal_merge.founding_id_column,         delete_mode => temporal_merge.delete_mode,         lookup_keys => v_natural_identity_keys_discovered,         ephemeral_columns => temporal_merge.ephemeral_columns,         p_log_trace => v_log_trace,         p_log_sql => v_log_sql     )"
3d8,Range-Only temporal_merge Child,,-4506542100372973631,1,246.9315,1000,759,0,0,0,0,140,16293,"CREATE TEMP TABLE resolved_atomic_segments_with_payloads ON COMMIT DROP AS                 SELECT                     with_base_payload.*,                     with_base_payload.stable_pk_payload as propagated_stable_pk_payload                 FROM (                     SELECT                         seg.grouping_key, seg.canonical_nk_json, seg.id, seg.causal_id, seg.is_new_entity, seg.is_identifiable, seg.is_ambiguous, seg.conflicting_ids, seg.stable_identity_columns_are_null, seg.natural_identity_column_values_are_null, seg.valid_from, seg.valid_until,                         target_payloads.t_valid_from, target_payloads.t_valid_until, source_payloads.source_row_id, source_payloads.contributing_row_ids, source_payloads.data_payload as s_data_payload, source_payloads.ephemeral_payload as s_ephemeral_payload,                         target_payloads.data_payload as t_data_payload, target_payloads.ephemeral_payload as t_ephemeral_payload, seg.stable_pk_payload, source_payloads.causal_id as s_causal_id, source_payloads.causal_id as direct_source_causal_id,                         source_payloads.valid_from AS s_valid_from, source_payloads.valid_until AS s_valid_until, NULL::jsonb as trace                     FROM atomic_segments seg                     LEFT JOIN LATERAL (                         SELECT target_row.data_payload, target_row.ephemeral_payload, target_row.valid_from as t_valid_from, target_row.valid_until as t_valid_until, target_row.stable_pk_payload                         FROM target_rows target_row                         WHERE (target_row.id = seg.id OR (target_row.id IS NULL AND seg.id IS NULL)) AND daterange(seg.valid_from, seg.valid_until) <@ daterange(target_row.valid_from, target_row.valid_until)                     ) target_payloads ON true                                              LEFT JOIN LATERAL (                             WITH RECURSIVE ordered_sources AS (                                 SELECT                                     source_row.source_row_id, source_row.data_payload, sou"
2dc,Range-Only temporal_merge Child,,1934132452462029724,1,246.05137499999998,1000,348,0,0,0,0,140,16293,"CREATE TEMP TABLE resolved_atomic_segments_with_payloads ON COMMIT DROP AS                 SELECT                     with_base_payload.*,                     with_base_payload.stable_pk_payload as propagated_stable_pk_payload                 FROM (                     SELECT                         seg.grouping_key, seg.canonical_nk_json, seg.id, seg.causal_id, seg.is_new_entity, seg.is_identifiable, seg.is_ambiguous, seg.conflicting_ids, seg.stable_identity_columns_are_null, seg.natural_identity_column_values_are_null, seg.valid_from, seg.valid_until,                         target_payloads.t_valid_from, target_payloads.t_valid_until, source_payloads.source_row_id, source_payloads.contributing_row_ids, source_payloads.data_payload as s_data_payload, source_payloads.ephemeral_payload as s_ephemeral_payload,                         target_payloads.data_payload as t_data_payload, target_payloads.ephemeral_payload as t_ephemeral_payload, seg.stable_pk_payload, source_payloads.causal_id as s_causal_id, source_payloads.causal_id as direct_source_causal_id,                         source_payloads.valid_from AS s_valid_from, source_payloads.valid_until AS s_valid_until, NULL::jsonb as trace                     FROM atomic_segments seg                     LEFT JOIN LATERAL (                         SELECT target_row.data_payload, target_row.ephemeral_payload, target_row.valid_from as t_valid_from, target_row.valid_until as t_valid_until, target_row.stable_pk_payload                         FROM target_rows target_row                         WHERE (target_row.id = seg.id OR (target_row.id IS NULL AND seg.id IS NULL)) AND daterange(seg.valid_from, seg.valid_until) <@ daterange(target_row.valid_from, target_row.valid_until)                     ) target_payloads ON true                                              LEFT JOIN LATERAL (                             WITH RECURSIVE ordered_sources AS (                                 SELECT                                     source_row.source_row_id, source_row.data_payload, sou"
7c5,Range-Only temporal_merge Child,,938093246872844266,1,74.477958,1000,101751,0,0,0,0,104,11311,"CREATE TEMP TABLE target_rows ON COMMIT DROP AS                 SELECT                     id,  /* v_non_temporal_lookup_cols_select_list_no_alias_prefix */ -- (non-temporal identity columns)                     lower(t.valid_range) as valid_from, -- The temporal identity column (e.g., valid_from)                     NULL::integer /* v_causal_column_type */ as causal_id, -- Target rows do not originate from a source row, so causal_id is NULL. Type is introspected.                     jsonb_build_object('id', id) /* v_stable_pk_cols_jsonb_build_bare */ as stable_pk_payload,                     upper(t.valid_range) as valid_until,                     jsonb_build_object('parent_id', parent_id, 'description', description) /* v_target_data_cols_jsonb_build_bare */ AS data_payload,                     jsonb_build_object() /* v_target_ephemeral_cols_jsonb_build_bare */ AS ephemeral_payload,                     jsonb_strip_nulls(jsonb_build_object('id', t.id)) /* v_target_nk_json_expr */ AS canonical_nk_json                 FROM (                         SELECT * FROM (                             SELECT DISTINCT ON (u.id, u.valid_range) * FROM (                                 (                                         SELECT DISTINCT ON (inner_t.id, inner_t.valid_range) inner_t.*                                         FROM child_range_only inner_t                                         JOIN (SELECT DISTINCT si.id FROM source_initial si) AS si ON ((si.id = inner_t.id OR (si.id IS NULL AND inner_t.id IS NULL)))                                     )                             ) u                         )                     ) AS t  /* v_target_rows_filter */"
2b3,Range-Only temporal_merge Child,,-452145526644945551,1,73.567166,1000,101272,0,0,0,0,102,11171,"CREATE TEMP TABLE target_rows ON COMMIT DROP AS                 SELECT                     id,  /* v_non_temporal_lookup_cols_select_list_no_alias_prefix */ -- (non-temporal identity columns)                     lower(t.valid_range) as valid_from, -- The temporal identity column (e.g., valid_from)                     NULL::integer /* v_causal_column_type */ as causal_id, -- Target rows do not originate from a source row, so causal_id is NULL. Type is introspected.                     jsonb_build_object('id', id) /* v_stable_pk_cols_jsonb_build_bare */ as stable_pk_payload,                     upper(t.valid_range) as valid_until,                     jsonb_build_object('parent_id', parent_id, 'description', description) /* v_target_data_cols_jsonb_build_bare */ AS data_payload,                     jsonb_build_object() /* v_target_ephemeral_cols_jsonb_build_bare */ AS ephemeral_payload,                     jsonb_strip_nulls(jsonb_build_object('id', t.id)) /* v_target_nk_json_expr */ AS canonical_nk_json                 FROM (                         SELECT * FROM (                             SELECT DISTINCT ON (u.id, u.valid_range) * FROM (                                 (                                         SELECT DISTINCT ON (inner_t.id, inner_t.valid_range) inner_t.*                                         FROM child_range_only inner_t                                         JOIN (SELECT DISTINCT si.id FROM source_initial si) AS si ON ((si.id = inner_t.id OR (si.id IS NULL AND inner_t.id IS NULL)))                                     )                             ) u                         )                     ) AS t  /* v_target_rows_filter */"
6fb,Range-Only temporal_merge Child,,4078766113940839250,1,33.174291,1000,730,0,0,0,0,117,17484,"CREATE TEMP TABLE source_with_eclipsed_flag ON COMMIT DROP AS                 SELECT                     s1.*,                     eclipse_info.is_eclipsed,                     eclipse_info.eclipsed_by                 FROM source_initial s1                 CROSS JOIN LATERAL (                     SELECT                         COALESCE(sql_saga.covers_without_gaps(daterange(s2.valid_from, s2.valid_until), daterange(s1.valid_from, s1.valid_until) ORDER BY s2.valid_from), false) as is_eclipsed,                         array_agg(s2.source_row_id) as eclipsed_by                     FROM source_initial s2                     WHERE                         (                             (NOT s1.natural_identity_column_values_are_null AND (s1.id IS NOT DISTINCT FROM s2.id))                             OR                             (s1.natural_identity_column_values_are_null AND s1.causal_id = s2.causal_id)                         )                         AND                         -- Only consider newer rows (higher row_id) as potential eclipsers.                         s2.source_row_id > s1.source_row_id                 ) eclipse_info"
13f,Range-Only temporal_merge Child,,798974767491603867,1,32.605208,1000,306,0,0,0,0,117,17484,"CREATE TEMP TABLE source_with_eclipsed_flag ON COMMIT DROP AS                 SELECT                     s1.*,                     eclipse_info.is_eclipsed,                     eclipse_info.eclipsed_by                 FROM source_initial s1                 CROSS JOIN LATERAL (                     SELECT                         COALESCE(sql_saga.covers_without_gaps(daterange(s2.valid_from, s2.valid_until), daterange(s1.valid_from, s1.valid_until) ORDER BY s2.valid_from), false) as is_eclipsed,                         array_agg(s2.source_row_id) as eclipsed_by                     FROM source_initial s2                     WHERE                         (                             (NOT s1.natural_identity_column_values_are_null AND (s1.id IS NOT DISTINCT FROM s2.id))                             OR                             (s1.natural_identity_column_values_are_null AND s1.causal_id = s2.causal_id)                         )                         AND                         -- Only consider newer rows (higher row_id) as potential eclipsers.                         s2.source_row_id > s1.source_row_id                 ) eclipse_info;"
4dc,Range-Only temporal_merge Child,,-408891117950312342,1,27.5435,1000,691,0,0,0,0,119,13413,"CREATE TEMP TABLE source_rows_with_matches ON COMMIT DROP AS                 SELECT                     source_row.*,                     target_row.stable_pk_payload as discovered_stable_pk_payload,                     target_row.id AS discovered_id_1 /* v_propagated_id_cols_list */                 FROM source_with_eclipsed_flag source_row                 LEFT JOIN target_rows target_row ON (((source_row.id IS NOT DISTINCT FROM target_row.id)) /* v_source_rows_exists_join_expr */)"
217,Range-Only temporal_merge Child,,3626869770245442582,1,26.979958,1000,311,0,0,0,0,119,13413,"CREATE TEMP TABLE source_rows_with_matches ON COMMIT DROP AS                 SELECT                     source_row.*,                     target_row.stable_pk_payload as discovered_stable_pk_payload,                     target_row.id AS discovered_id_1 /* v_propagated_id_cols_list */                 FROM source_with_eclipsed_flag source_row                 LEFT JOIN target_rows target_row ON (((source_row.id IS NOT DISTINCT FROM target_row.id)) /* v_source_rows_exists_join_expr */)"
010,Range-Only temporal_merge Child,,-2046183703977100040,1,10.15675,4000,659,0,0,0,0,116,13093,"CREATE TEMP TABLE time_points_unified ON COMMIT DROP AS                 SELECT                     *,                     CASE                 WHEN is_new_entity                 THEN 'new_entity__' || CASE WHEN canonical_nk_json IS NOT NULL AND canonical_nk_json <> '{}'::jsonb THEN COALESCE(canonical_nk_json->>'id', '_NULL_') ELSE COALESCE(id::text, '_NULL_') END                 ELSE 'existing_entity__' || COALESCE(id::text, '_NULL_')             END AS grouping_key,                     CASE                         WHEN is_new_entity THEN causal_id                         ELSE FIRST_VALUE(causal_id) OVER (PARTITION BY CASE                 WHEN is_new_entity                 THEN 'new_entity__' || CASE WHEN canonical_nk_json IS NOT NULL AND canonical_nk_json <> '{}'::jsonb THEN COALESCE(canonical_nk_json->>'id', '_NULL_') ELSE COALESCE(id::text, '_NULL_') END                 ELSE 'existing_entity__' || COALESCE(id::text, '_NULL_')             END ORDER BY causal_id ASC NULLS LAST)                     END as unified_causal_id,                     FIRST_VALUE(stable_pk_payload) OVER (PARTITION BY CASE                 WHEN is_new_entity                 THEN 'new_entity__' || CASE WHEN canonical_nk_json IS NOT NULL AND canonical_nk_json <> '{}'::jsonb THEN COALESCE(canonical_nk_json->>'id', '_NULL_') ELSE COALESCE(id::text, '_NULL_') END                 ELSE 'existing_entity__' || COALESCE(id::text, '_NULL_')             END ORDER BY causal_id ASC NULLS FIRST) as unified_stable_pk_payload,                     FIRST_VALUE(canonical_nk_json) OVER (PARTITION BY CASE                 WHEN is_new_entity                 THEN 'new_entity__' || CASE WHEN canonical_nk_json IS NOT NULL AND canonical_nk_json <> '{}'::jsonb THEN COALESCE(canonical_nk_json->>'id', '_NULL_') ELSE COALESCE(id::text, '_NULL_') END                 ELSE 'existing_entity__' || COALESCE(id::text, '_NULL_')             END ORDER BY causal_id ASC NULLS FIRST) as unified_canonical_nk_json                 FROM time_points_raw"
caf,Range-Only temporal_merge Parent,,7071287273656641802,1,13210.8585,0,1609846,0,0,0,0,9268,949475,"CALL sql_saga.temporal_merge('parent_range_only'::regclass, 'parent_source_range_only'::regclass, ARRAY['id'])"
9a1,Range-Only temporal_merge Parent,,-2577546157031926366,1,12675.275167,0,1394608,0,0,0,0,5299,467228,"CALL sql_saga.temporal_merge_execute(         target_table => temporal_merge.target_table,         source_table => temporal_merge.source_table,         identity_columns => v_identity_cols_discovered,         mode => temporal_merge.mode,         era_name => temporal_merge.era_name,         row_id_column => temporal_merge.row_id_column,         founding_id_column => temporal_merge.founding_id_column,         update_source_with_identity => temporal_merge.update_source_with_identity,         lookup_columns => v_natural_identity_cols_discovered,         delete_mode => temporal_merge.delete_mode,         update_source_with_feedback => temporal_merge.update_source_with_feedback,         feedback_status_column => temporal_merge.feedback_status_column,         feedback_status_key => temporal_merge.feedback_status_key,         feedback_error_column => temporal_merge.feedback_error_column,         feedback_error_key => temporal_merge.feedback_error_key,         ephemeral_columns => temporal_merge.ephemeral_columns,         delay_constraints => temporal_merge.delay_constraints     )"
bfe,Range-Only temporal_merge Parent,,-6715341742223327474,1,12663.07825,1000,1391844,0,0,0,0,5028,437165,"UPDATE parent_range_only t SET valid_range = daterange(p.new_valid_from::date, p.new_valid_until::date, '[)'), name = CASE WHEN p.data ? 'name' THEN (p.data->>'name')::character varying ELSE t.name END                                 FROM (SELECT * FROM temporal_merge_plan WHERE operation = 'UPDATE' AND statement_seq = 1 ORDER BY plan_op_seq) p,                                      LATERAL jsonb_populate_record(null::parent_range_only, p.entity_keys) AS jpr_entity                                 WHERE (t.id = jpr_entity.id OR (t.id IS NULL AND jpr_entity.id IS NULL)) AND t.valid_range = daterange(p.old_valid_from::date, p.old_valid_until::date, '[)')"
88c,Range-Only temporal_merge Parent,,482662322732680403,1,533.477958,1000,214202,0,0,0,0,3791,463159,"INSERT INTO temporal_merge_plan     SELECT * FROM sql_saga.temporal_merge_plan(         target_table => temporal_merge.target_table,         source_table => temporal_merge.source_table,         mode => temporal_merge.mode,         era_name => temporal_merge.era_name,         identity_columns => v_identity_cols_discovered,         row_id_column => temporal_merge.row_id_column,         founding_id_column => temporal_merge.founding_id_column,         delete_mode => temporal_merge.delete_mode,         lookup_keys => v_natural_identity_keys_discovered,         ephemeral_columns => temporal_merge.ephemeral_columns,         p_log_trace => v_log_trace,         p_log_sql => v_log_sql     )"
8c4,Range-Only temporal_merge Parent,,-4506542100372973631,1,244.686292,1000,763,0,0,0,0,141,16343,"CREATE TEMP TABLE resolved_atomic_segments_with_payloads ON COMMIT DROP AS                 SELECT                     with_base_payload.*,                     with_base_payload.stable_pk_payload as propagated_stable_pk_payload                 FROM (                     SELECT                         seg.grouping_key, seg.canonical_nk_json, seg.id, seg.causal_id, seg.is_new_entity, seg.is_identifiable, seg.is_ambiguous, seg.conflicting_ids, seg.stable_identity_columns_are_null, seg.natural_identity_column_values_are_null, seg.valid_from, seg.valid_until,                         target_payloads.t_valid_from, target_payloads.t_valid_until, source_payloads.source_row_id, source_payloads.contributing_row_ids, source_payloads.data_payload as s_data_payload, source_payloads.ephemeral_payload as s_ephemeral_payload,                         target_payloads.data_payload as t_data_payload, target_payloads.ephemeral_payload as t_ephemeral_payload, seg.stable_pk_payload, source_payloads.causal_id as s_causal_id, source_payloads.causal_id as direct_source_causal_id,                         source_payloads.valid_from AS s_valid_from, source_payloads.valid_until AS s_valid_until, NULL::jsonb as trace                     FROM atomic_segments seg                     LEFT JOIN LATERAL (                         SELECT target_row.data_payload, target_row.ephemeral_payload, target_row.valid_from as t_valid_from, target_row.valid_until as t_valid_until, target_row.stable_pk_payload                         FROM target_rows target_row                         WHERE (target_row.id = seg.id OR (target_row.id IS NULL AND seg.id IS NULL)) AND daterange(seg.valid_from, seg.valid_until) <@ daterange(target_row.valid_from, target_row.valid_until)                     ) target_payloads ON true                                              LEFT JOIN LATERAL (                             WITH RECURSIVE ordered_sources AS (                                 SELECT                                     source_row.source_row_id, source_row.data_payload, sou"
