log_id,event,label,queryid,calls,total_exec_time,rows,shared_blks_hit,shared_blks_read,temp_blks_read,temp_blks_written,total_plan_time,wal_records,wal_bytes,query
cc4,Range-Only Child INSERT,,-1513128718422397264,1,34.297334,1000,17022,0,0,0,0,8027,802472,"INSERT INTO child_range_only (id, valid_range, parent_id, description) SELECT i, daterange('2015-01-01', 'infinity', '[)'), i, 'New Shop ' || i FROM generate_series(10001, 11000) i"
324,Range-Only Child INSERT,,3801168477474623637,1000,6.520273,1000,4000,0,0,0,0,1000,54000,"SELECT 1 FROM (SELECT ""valid_range"" AS r FROM ONLY ""public"".""parent_range_only"" x WHERE ""id"" OPERATOR(pg_catalog.=) $1 AND ""valid_range""::pg_catalog.anyrange OPERATOR(pg_catalog.&&) $2::pg_catalog.anyrange FOR KEY SHARE OF x) x1 HAVING   $2::pg_catalog.anyrange OPERATOR(pg_catalog.<@) pg_catalog.range_agg(x1.r)"
bd3,Range-Only Child UPDATE Key,,2032682557053950028,1,28.112959,1000,24050,0,0,0,0,7048,576909,"UPDATE child_range_only SET valid_range = daterange('2014-01-01', upper(valid_range), '[)') WHERE id BETWEEN 1 AND 1000"
636,Range-Only Child UPDATE Key,,3801168477474623637,1000,7.305819999999998,1000,6000,0,0,0,0,1009,56740,"SELECT 1 FROM (SELECT ""valid_range"" AS r FROM ONLY ""public"".""parent_range_only"" x WHERE ""id"" OPERATOR(pg_catalog.=) $1 AND ""valid_range""::pg_catalog.anyrange OPERATOR(pg_catalog.&&) $2::pg_catalog.anyrange FOR KEY SHARE OF x) x1 HAVING   $2::pg_catalog.anyrange OPERATOR(pg_catalog.<@) pg_catalog.range_agg(x1.r)"
e78,Range-Only Child UPDATE Non-Key,,-7180486638484984037,1,11.989583,1000,15696,0,0,0,0,5886,512378,UPDATE child_range_only SET description = 'Updated Shop' WHERE id BETWEEN 1001 AND 2000
349,Range-Only Parent DELETE (no children),,-4539091173828576470,1,10.812958,1000,4014,0,0,0,0,1000,54000,DELETE FROM parent_range_only WHERE id BETWEEN 20001 AND 21000
8e2,Range-Only Parent DELETE (no children),,476854885423386359,1000,2.134598999999997,0,1000,0,0,0,0,0,0,"SELECT 1 FROM ONLY ""public"".""child_range_only"" x WHERE $1 OPERATOR(pg_catalog.=) ""parent_id"" AND $2::pg_catalog.anyrange OPERATOR(pg_catalog.&&) ""valid_range""::pg_catalog.anyrange AND NOT coalesce(  (  ""valid_range""::pg_catalog.anyrange OPERATOR(pg_catalog.*) $2::pg_catalog.anyrange)::pg_catalog.anyrange OPERATOR(pg_catalog.<@) (SELECT pg_catalog.range_agg(r) FROM (SELECT y.""valid_range"" r FROM ONLY ""public"".""parent_range_only"" y WHERE $1 OPERATOR(pg_catalog.=) ""id"" AND $2::pg_catalog.anyrange OPERATOR(pg_catalog.&&) ""valid_range""::pg_catalog.anyrange FOR KEY SHARE OF y) y2), false) FOR KEY SHARE OF x"
ae1,Range-Only Parent INSERT,,6357836274575580935,1,19.929458,1000,10045,0,0,0,0,5018,506576,"INSERT INTO parent_range_only (id, valid_range, name) SELECT i, daterange('2015-01-01', 'infinity', '[)'), 'New Company ' || i FROM generate_series(20001, 21000) i"
605,Range-Only Parent UPDATE Key,,1252438658754027224,1,40.427667,1000,24129,0,0,0,0,6032,503782,"UPDATE parent_range_only SET valid_range = daterange('2014-01-01', upper(valid_range), '[)') WHERE id BETWEEN 1 AND 1000"
b22,Range-Only Parent UPDATE Key,,476854885423386359,1000,12.48131799999996,0,8000,0,0,0,0,1000,54000,"SELECT 1 FROM ONLY ""public"".""child_range_only"" x WHERE $1 OPERATOR(pg_catalog.=) ""parent_id"" AND $2::pg_catalog.anyrange OPERATOR(pg_catalog.&&) ""valid_range""::pg_catalog.anyrange AND NOT coalesce(  (  ""valid_range""::pg_catalog.anyrange OPERATOR(pg_catalog.*) $2::pg_catalog.anyrange)::pg_catalog.anyrange OPERATOR(pg_catalog.<@) (SELECT pg_catalog.range_agg(r) FROM (SELECT y.""valid_range"" r FROM ONLY ""public"".""parent_range_only"" y WHERE $1 OPERATOR(pg_catalog.=) ""id"" AND $2::pg_catalog.anyrange OPERATOR(pg_catalog.&&) ""valid_range""::pg_catalog.anyrange FOR KEY SHARE OF y) y2), false) FOR KEY SHARE OF x"
e14,Range-Only Parent UPDATE Non-Key,,-7028987207714112929,1,11.665208999999999,1000,13617,0,0,0,0,4866,433344,UPDATE parent_range_only SET name = 'Updated Company' WHERE id BETWEEN 1001 AND 2000
c1b,Range-Only temporal_merge Child,,-5377174872283495769,1,6145.268083,0,840421,0,0,0,0,10414,1060774,"CALL sql_saga.temporal_merge('child_range_only'::regclass, 'child_source_range_only'::regclass, ARRAY['id'])"
e6b,Range-Only temporal_merge Child,,3350431269411476272,1,5792.104417,0,708916,0,0,0,0,6332,567768,"CALL sql_saga.temporal_merge_execute(         target_table => temporal_merge.target_table,         source_table => temporal_merge.source_table,         identity_columns => v_identity_cols_discovered,         mode => temporal_merge.mode,         era_name => temporal_merge.era_name,         row_id_column => temporal_merge.row_id_column,         founding_id_column => temporal_merge.founding_id_column,         update_source_with_identity => temporal_merge.update_source_with_identity,         lookup_columns => v_natural_identity_cols_discovered,         delete_mode => temporal_merge.delete_mode,         update_source_with_feedback => temporal_merge.update_source_with_feedback,         feedback_status_column => temporal_merge.feedback_status_column,         feedback_status_key => temporal_merge.feedback_status_key,         feedback_error_column => temporal_merge.feedback_error_column,         feedback_error_key => temporal_merge.feedback_error_key,         ephemeral_columns => temporal_merge.ephemeral_columns,         delay_constraints => temporal_merge.delay_constraints     )"
3f1,Range-Only temporal_merge Child,,1041390310958375615,1,5779.7535,1000,705342,0,0,0,0,6058,536799,"UPDATE child_range_only t SET valid_range = daterange(p.new_valid_from::date, p.new_valid_until::date, '[)'), parent_id = CASE WHEN p.data ? 'parent_id' THEN (p.data->>'parent_id')::integer ELSE t.parent_id END, description = CASE WHEN p.data ? 'description' THEN (p.data->>'description')::text ELSE t.description END                                 FROM (SELECT * FROM temporal_merge_plan WHERE operation = 'UPDATE' AND statement_seq = 1 ORDER BY plan_op_seq) p,                                      LATERAL jsonb_populate_record(null::child_range_only, p.entity_keys) AS jpr_entity                                 WHERE (t.id = jpr_entity.id OR (t.id IS NULL AND jpr_entity.id IS NULL)) AND t.valid_range = daterange(p.old_valid_from::date, p.old_valid_until::date, '[)')"
2a5,Range-Only temporal_merge Child,,-7007799885084183350,1,350.30675,1000,129964,0,0,0,0,3907,474056,"INSERT INTO temporal_merge_plan     SELECT * FROM sql_saga.temporal_merge_plan(         target_table => temporal_merge.target_table,         source_table => temporal_merge.source_table,         mode => temporal_merge.mode,         era_name => temporal_merge.era_name,         identity_columns => v_identity_cols_discovered,         row_id_column => temporal_merge.row_id_column,         founding_id_column => temporal_merge.founding_id_column,         delete_mode => temporal_merge.delete_mode,         lookup_keys => v_natural_identity_keys_discovered,         ephemeral_columns => temporal_merge.ephemeral_columns,         p_log_trace => v_log_trace,         p_log_sql => v_log_sql     )"
843,Range-Only temporal_merge Child,,4748073848864616921,1,94.098792,1000,768,0,0,0,0,127,15853,"CREATE TEMP TABLE existing_segments_with_target ON COMMIT DROP AS                 SELECT                     seg.grouping_key, seg.canonical_nk_json, seg.id, seg.causal_id, seg.is_new_entity, seg.is_identifiable, seg.is_ambiguous, seg.conflicting_ids, seg.stable_identity_columns_are_null, seg.natural_identity_column_values_are_null, seg.valid_from, seg.valid_until,                     target_row.valid_from as t_valid_from, target_row.valid_until as t_valid_until,                     target_row.data_payload as t_data_payload, target_row.ephemeral_payload as t_ephemeral_payload, seg.stable_pk_payload,                      target_row.stable_pk_payload as target_stable_pk_payload,                     NULL::jsonb as trace                 FROM atomic_segments seg                 LEFT JOIN target_rows target_row                      ON (target_row.id = seg.id OR (target_row.id IS NULL AND seg.id IS NULL))                      AND daterange(seg.valid_from, seg.valid_until) <@ daterange(target_row.valid_from, target_row.valid_until)                 WHERE NOT seg.is_new_entity"
876,Range-Only temporal_merge Child,,-4685191513584255900,1,93.542708,1000,322,0,0,0,0,127,15853,"CREATE TEMP TABLE existing_segments_with_target ON COMMIT DROP AS                 SELECT                     seg.grouping_key, seg.canonical_nk_json, seg.id, seg.causal_id, seg.is_new_entity, seg.is_identifiable, seg.is_ambiguous, seg.conflicting_ids, seg.stable_identity_columns_are_null, seg.natural_identity_column_values_are_null, seg.valid_from, seg.valid_until,                     target_row.valid_from as t_valid_from, target_row.valid_until as t_valid_until,                     target_row.data_payload as t_data_payload, target_row.ephemeral_payload as t_ephemeral_payload, seg.stable_pk_payload,                      target_row.stable_pk_payload as target_stable_pk_payload,                     NULL::jsonb as trace                 FROM atomic_segments seg                 LEFT JOIN target_rows target_row                      ON (target_row.id = seg.id OR (target_row.id IS NULL AND seg.id IS NULL))                      AND daterange(seg.valid_from, seg.valid_until) <@ daterange(target_row.valid_from, target_row.valid_until)                 WHERE NOT seg.is_new_entity"
5ec,Range-Only temporal_merge Child,,938093246872844266,1,78.4165,1000,101809,0,0,0,0,104,11307,"CREATE TEMP TABLE target_rows ON COMMIT DROP AS                 SELECT                     id,  /* v_non_temporal_lookup_cols_select_list_no_alias_prefix */ -- (non-temporal identity columns)                     lower(t.valid_range) as valid_from, -- The temporal identity column (e.g., valid_from)                     NULL::integer /* v_causal_column_type */ as causal_id, -- Target rows do not originate from a source row, so causal_id is NULL. Type is introspected.                     jsonb_build_object('id', id) /* v_stable_pk_cols_jsonb_build_bare */ as stable_pk_payload,                     upper(t.valid_range) as valid_until,                     jsonb_build_object('parent_id', parent_id, 'description', description) /* v_target_data_cols_jsonb_build_bare */ AS data_payload,                     jsonb_build_object() /* v_target_ephemeral_cols_jsonb_build_bare */ AS ephemeral_payload,                     jsonb_strip_nulls(jsonb_build_object('id', t.id)) /* v_target_nk_json_expr */ AS canonical_nk_json                 FROM (                         SELECT * FROM (                             SELECT DISTINCT ON (u.id, u.valid_range) * FROM (                                 (                                         SELECT DISTINCT ON (inner_t.id, inner_t.valid_range) inner_t.*                                         FROM child_range_only inner_t                                         JOIN (SELECT DISTINCT si.id FROM source_initial si) AS si ON ((si.id = inner_t.id OR (si.id IS NULL AND inner_t.id IS NULL)))                                     )                             ) u                         )                     ) AS t  /* v_target_rows_filter */"
c24,Range-Only temporal_merge Child,,-452145526644945551,1,77.553709,1000,101274,0,0,0,0,102,11171,"CREATE TEMP TABLE target_rows ON COMMIT DROP AS                 SELECT                     id,  /* v_non_temporal_lookup_cols_select_list_no_alias_prefix */ -- (non-temporal identity columns)                     lower(t.valid_range) as valid_from, -- The temporal identity column (e.g., valid_from)                     NULL::integer /* v_causal_column_type */ as causal_id, -- Target rows do not originate from a source row, so causal_id is NULL. Type is introspected.                     jsonb_build_object('id', id) /* v_stable_pk_cols_jsonb_build_bare */ as stable_pk_payload,                     upper(t.valid_range) as valid_until,                     jsonb_build_object('parent_id', parent_id, 'description', description) /* v_target_data_cols_jsonb_build_bare */ AS data_payload,                     jsonb_build_object() /* v_target_ephemeral_cols_jsonb_build_bare */ AS ephemeral_payload,                     jsonb_strip_nulls(jsonb_build_object('id', t.id)) /* v_target_nk_json_expr */ AS canonical_nk_json                 FROM (                         SELECT * FROM (                             SELECT DISTINCT ON (u.id, u.valid_range) * FROM (                                 (                                         SELECT DISTINCT ON (inner_t.id, inner_t.valid_range) inner_t.*                                         FROM child_range_only inner_t                                         JOIN (SELECT DISTINCT si.id FROM source_initial si) AS si ON ((si.id = inner_t.id OR (si.id IS NULL AND inner_t.id IS NULL)))                                     )                             ) u                         )                     ) AS t  /* v_target_rows_filter */"
f8c,Range-Only temporal_merge Child,,8031435135147892344,1,34.029708,1000,783,0,0,0,0,115,12851,"CREATE TEMP TABLE source_with_eclipsed_flag ON COMMIT DROP AS                 SELECT                     s1.*,                     eclipse_info.is_eclipsed,                     eclipse_info.eclipsed_by                 FROM source_initial s1                 CROSS JOIN LATERAL (                     SELECT                         COALESCE(sql_saga.covers_without_gaps(daterange(s2.valid_from, s2.valid_until), daterange(s1.valid_from, s1.valid_until) ORDER BY s2.valid_from), false) as is_eclipsed,                         array_agg(s2.source_row_id) as eclipsed_by                     FROM source_initial s2                     WHERE                         (                             (NOT s1.natural_identity_column_values_are_null AND (s1.id IS NOT DISTINCT FROM s2.id))                             OR                             (s1.natural_identity_column_values_are_null AND s1.causal_id = s2.causal_id)                         )                         AND                         -- Only consider newer rows (higher row_id) as potential eclipsers.                         s2.source_row_id > s1.source_row_id                 ) eclipse_info"
7ef,Range-Only temporal_merge Child,,-2607263457913468663,1,33.458667,1000,303,0,0,0,0,115,12851,"CREATE TEMP TABLE source_with_eclipsed_flag ON COMMIT DROP AS                 SELECT                     s1.*,                     eclipse_info.is_eclipsed,                     eclipse_info.eclipsed_by                 FROM source_initial s1                 CROSS JOIN LATERAL (                     SELECT                         COALESCE(sql_saga.covers_without_gaps(daterange(s2.valid_from, s2.valid_until), daterange(s1.valid_from, s1.valid_until) ORDER BY s2.valid_from), false) as is_eclipsed,                         array_agg(s2.source_row_id) as eclipsed_by                     FROM source_initial s2                     WHERE                         (                             (NOT s1.natural_identity_column_values_are_null AND (s1.id IS NOT DISTINCT FROM s2.id))                             OR                             (s1.natural_identity_column_values_are_null AND s1.causal_id = s2.causal_id)                         )                         AND                         -- Only consider newer rows (higher row_id) as potential eclipsers.                         s2.source_row_id > s1.source_row_id                 ) eclipse_info;"
f43,Range-Only temporal_merge Child,,-408891117950312342,1,28.313083,1000,744,0,0,0,0,119,13387,"CREATE TEMP TABLE source_rows_with_matches ON COMMIT DROP AS                 SELECT                     source_row.*,                     target_row.stable_pk_payload as discovered_stable_pk_payload,                     target_row.id AS discovered_id_1 /* v_propagated_id_cols_list */                 FROM source_with_eclipsed_flag source_row                 LEFT JOIN target_rows target_row ON (((source_row.id IS NOT DISTINCT FROM target_row.id)) /* v_source_rows_exists_join_expr */)"
c36,Range-Only temporal_merge Child,,3626869770245442582,1,27.788499,1000,308,0,0,0,0,119,13387,"CREATE TEMP TABLE source_rows_with_matches ON COMMIT DROP AS                 SELECT                     source_row.*,                     target_row.stable_pk_payload as discovered_stable_pk_payload,                     target_row.id AS discovered_id_1 /* v_propagated_id_cols_list */                 FROM source_with_eclipsed_flag source_row                 LEFT JOIN target_rows target_row ON (((source_row.id IS NOT DISTINCT FROM target_row.id)) /* v_source_rows_exists_join_expr */)"
069,Range-Only temporal_merge Child,,-2046183703977100040,1,10.300458,4000,721,0,0,0,0,117,13164,"CREATE TEMP TABLE time_points_unified ON COMMIT DROP AS                 SELECT                     *,                     CASE                 WHEN is_new_entity                 THEN 'new_entity__' || CASE WHEN canonical_nk_json IS NOT NULL AND canonical_nk_json <> '{}'::jsonb THEN COALESCE(canonical_nk_json->>'id', '_NULL_') ELSE COALESCE(id::text, '_NULL_') END                 ELSE 'existing_entity__' || COALESCE(id::text, '_NULL_')             END AS grouping_key,                     CASE                         WHEN is_new_entity THEN causal_id                         ELSE FIRST_VALUE(causal_id) OVER (PARTITION BY CASE                 WHEN is_new_entity                 THEN 'new_entity__' || CASE WHEN canonical_nk_json IS NOT NULL AND canonical_nk_json <> '{}'::jsonb THEN COALESCE(canonical_nk_json->>'id', '_NULL_') ELSE COALESCE(id::text, '_NULL_') END                 ELSE 'existing_entity__' || COALESCE(id::text, '_NULL_')             END ORDER BY causal_id ASC NULLS LAST)                     END as unified_causal_id,                     FIRST_VALUE(stable_pk_payload) OVER (PARTITION BY CASE                 WHEN is_new_entity                 THEN 'new_entity__' || CASE WHEN canonical_nk_json IS NOT NULL AND canonical_nk_json <> '{}'::jsonb THEN COALESCE(canonical_nk_json->>'id', '_NULL_') ELSE COALESCE(id::text, '_NULL_') END                 ELSE 'existing_entity__' || COALESCE(id::text, '_NULL_')             END ORDER BY causal_id ASC NULLS FIRST) as unified_stable_pk_payload,                     FIRST_VALUE(canonical_nk_json) OVER (PARTITION BY CASE                 WHEN is_new_entity                 THEN 'new_entity__' || CASE WHEN canonical_nk_json IS NOT NULL AND canonical_nk_json <> '{}'::jsonb THEN COALESCE(canonical_nk_json->>'id', '_NULL_') ELSE COALESCE(id::text, '_NULL_') END                 ELSE 'existing_entity__' || COALESCE(id::text, '_NULL_')             END ORDER BY causal_id ASC NULLS FIRST) as unified_canonical_nk_json                 FROM time_points_raw"
520,Range-Only temporal_merge Parent,,-5377174872283495769,1,13751.593541,0,1616112,0,0,0,0,9517,993815,"CALL sql_saga.temporal_merge('parent_range_only'::regclass, 'parent_source_range_only'::regclass, ARRAY['id'])"
637,Range-Only temporal_merge Parent,,3350431269411476272,1,13107.628292,0,1397430,0,0,0,0,5297,471326,"CALL sql_saga.temporal_merge_execute(         target_table => temporal_merge.target_table,         source_table => temporal_merge.source_table,         identity_columns => v_identity_cols_discovered,         mode => temporal_merge.mode,         era_name => temporal_merge.era_name,         row_id_column => temporal_merge.row_id_column,         founding_id_column => temporal_merge.founding_id_column,         update_source_with_identity => temporal_merge.update_source_with_identity,         lookup_columns => v_natural_identity_cols_discovered,         delete_mode => temporal_merge.delete_mode,         update_source_with_feedback => temporal_merge.update_source_with_feedback,         feedback_status_column => temporal_merge.feedback_status_column,         feedback_status_key => temporal_merge.feedback_status_key,         feedback_error_column => temporal_merge.feedback_error_column,         feedback_error_key => temporal_merge.feedback_error_key,         ephemeral_columns => temporal_merge.ephemeral_columns,         delay_constraints => temporal_merge.delay_constraints     )"
36f,Range-Only temporal_merge Parent,,1507507329580887170,1,13095.457667,1000,1394454,0,0,0,0,5028,437161,"UPDATE parent_range_only t SET valid_range = daterange(p.new_valid_from::date, p.new_valid_until::date, '[)'), name = CASE WHEN p.data ? 'name' THEN (p.data->>'name')::character varying ELSE t.name END                                 FROM (SELECT * FROM temporal_merge_plan WHERE operation = 'UPDATE' AND statement_seq = 1 ORDER BY plan_op_seq) p,                                      LATERAL jsonb_populate_record(null::parent_range_only, p.entity_keys) AS jpr_entity                                 WHERE (t.id = jpr_entity.id OR (t.id IS NULL AND jpr_entity.id IS NULL)) AND t.valid_range = daterange(p.old_valid_from::date, p.old_valid_until::date, '[)')"
fdb,Range-Only temporal_merge Parent,,-7007799885084183350,1,641.666417,1000,217602,0,0,0,0,4046,503707,"INSERT INTO temporal_merge_plan     SELECT * FROM sql_saga.temporal_merge_plan(         target_table => temporal_merge.target_table,         source_table => temporal_merge.source_table,         mode => temporal_merge.mode,         era_name => temporal_merge.era_name,         identity_columns => v_identity_cols_discovered,         row_id_column => temporal_merge.row_id_column,         founding_id_column => temporal_merge.founding_id_column,         delete_mode => temporal_merge.delete_mode,         lookup_keys => v_natural_identity_keys_discovered,         ephemeral_columns => temporal_merge.ephemeral_columns,         p_log_trace => v_log_trace,         p_log_sql => v_log_sql     )"
744,Range-Only temporal_merge Parent,,4906793074655076905,1,177.630708,1000,854,0,0,0,0,143,20363,"CREATE TEMP TABLE resolved_atomic_segments_with_payloads ON COMMIT DROP AS                 WITH all_segments AS (                     SELECT * FROM existing_segments_with_target                     UNION ALL                     SELECT * FROM new_segments_no_target                 )                 SELECT                     with_base_payload.*,                     with_base_payload.stable_pk_payload as propagated_stable_pk_payload                 FROM (                     SELECT                         seg.*, source_payloads.source_row_id, source_payloads.contributing_row_ids,                          source_payloads.data_payload as s_data_payload, source_payloads.ephemeral_payload as s_ephemeral_payload,                         source_payloads.causal_id as s_causal_id, source_payloads.causal_id as direct_source_causal_id,                         source_payloads.valid_from AS s_valid_from, source_payloads.valid_until AS s_valid_until                     FROM all_segments seg                                              LEFT JOIN LATERAL (                             WITH RECURSIVE ordered_sources AS (                                 SELECT                                     source_row.source_row_id, source_row.data_payload, source_row.ephemeral_payload,                                     source_row.valid_from, source_row.valid_until, source_row.causal_id,                                     row_number() OVER (ORDER BY source_row.source_row_id) as rn                                 FROM active_source_rows source_row                                 WHERE                  ((seg.is_new_entity AND source_row.grouping_key = seg.grouping_key)                 OR                 (NOT seg.is_new_entity AND (source_row.id = seg.id OR (source_row.id IS NULL AND seg.id IS NULL))))              -- v_lateral_join_sr_to_seg                                 AND daterange(seg.valid_from, seg.valid_until) <@ daterange(source_row.valid_from, source_row.valid_until)                             ),                             running"
