log_id,event,label,queryid,calls,total_exec_time,rows,shared_blks_hit,shared_blks_read,temp_blks_read,temp_blks_written,total_plan_time,wal_records,wal_bytes,query
354,Range-Only Child INSERT,,-1513128718422397264,1,30.935582999999998,1000,21027,0,0,0,0,10039,1010568,"INSERT INTO child_range_only (id, valid_range, parent_id, description) SELECT i, daterange('2015-01-01', 'infinity', '[)'), i, 'New Shop ' || i FROM generate_series(10001, 11000) i"
deb,Range-Only Child UPDATE Key,,2032682557053950028,1,31.195667,1000,28068,0,0,0,0,9064,807449,"UPDATE child_range_only SET valid_range = daterange('2014-01-01', upper(valid_range), '[)') WHERE id BETWEEN 1 AND 1000"
edc,Range-Only Child UPDATE Non-Key,,-7180486638484984037,1,14.048125,1000,19615,0,0,0,0,7847,738684,UPDATE child_range_only SET description = 'Updated Shop' WHERE id BETWEEN 1001 AND 2000
859,Range-Only Parent INSERT,,6357836274575580935,1,23.346667,1000,14064,0,0,0,0,7029,707544,"INSERT INTO parent_range_only (id, valid_range, name) SELECT i, daterange('2015-01-01', 'infinity', '[)'), 'New Company ' || i FROM generate_series(20001, 21000) i"
d3e,Range-Only Parent UPDATE Key,,1252438658754027224,1,46.753875,1000,28160,0,0,0,0,8047,727194,"UPDATE parent_range_only SET valid_range = daterange('2014-01-01', upper(valid_range), '[)') WHERE id BETWEEN 1 AND 1000"
fc7,Range-Only Parent UPDATE Non-Key,,-7028987207714112929,1,13.233708,1000,17488,0,0,0,0,6803,657802,UPDATE parent_range_only SET name = 'Updated Company' WHERE id BETWEEN 1001 AND 2000
347,Range-Only temporal_merge Child,,4867474512602101550,1,284.06975,0,55767,0,0,0,0,12737,1401312,"CALL sql_saga.temporal_merge('child_range_only'::regclass, 'child_source_range_only'::regclass, ARRAY['id'])"
266,Range-Only temporal_merge Parent,,4867474512602101550,1,270.927792,0,56616,1,0,0,0,11849,1315922,"CALL sql_saga.temporal_merge('parent_range_only'::regclass, 'parent_source_range_only'::regclass, ARRAY['id'])"
