log_id,event,label,queryid,calls,total_exec_time,rows,shared_blks_hit,shared_blks_read,temp_blks_read,temp_blks_written,total_plan_time,wal_records,wal_bytes,query
e39,Range-Only Child INSERT,,-1513128718422397264,1,29.777958,1000,21027,0,0,0,0,10039,1010568,"INSERT INTO child_range_only (id, valid_range, parent_id, description) SELECT i, daterange('2015-01-01', 'infinity', '[)'), i, 'New Shop ' || i FROM generate_series(10001, 11000) i"
bc5,Range-Only Child UPDATE Key,,2032682557053950028,1,29.530333,1000,28068,0,0,0,0,9064,807449,"UPDATE child_range_only SET valid_range = daterange('2014-01-01', upper(valid_range), '[)') WHERE id BETWEEN 1 AND 1000"
62a,Range-Only Child UPDATE Non-Key,,-7180486638484984037,1,13.488376,1000,19615,0,0,0,0,7848,745812,UPDATE child_range_only SET description = 'Updated Shop' WHERE id BETWEEN 1001 AND 2000
763,Range-Only Parent INSERT,,6357836274575580935,1,20.167,1000,14064,0,0,0,0,7030,714672,"INSERT INTO parent_range_only (id, valid_range, name) SELECT i, daterange('2015-01-01', 'infinity', '[)'), 'New Company ' || i FROM generate_series(20001, 21000) i"
0ed,Range-Only Parent UPDATE Key,,1252438658754027224,1,42.021584000000004,1000,28160,0,0,0,0,8047,727194,"UPDATE parent_range_only SET valid_range = daterange('2014-01-01', upper(valid_range), '[)') WHERE id BETWEEN 1 AND 1000"
00a,Range-Only Parent UPDATE Non-Key,,-7028987207714112929,1,12.544833,1000,17488,0,0,0,0,6803,657802,UPDATE parent_range_only SET name = 'Updated Company' WHERE id BETWEEN 1001 AND 2000
108,Range-Only temporal_merge Child,,1511616357439475083,1,261.924208,0,56393,0,0,0,0,12730,1396884,"CALL sql_saga.temporal_merge('child_range_only'::regclass, 'child_source_range_only'::regclass, ARRAY['id'])"
e80,Range-Only temporal_merge Parent,,1511616357439475083,1,257.855083,0,57263,1,0,0,0,11854,1323875,"CALL sql_saga.temporal_merge('parent_range_only'::regclass, 'parent_source_range_only'::regclass, ARRAY['id'])"
