log_id,event,label,queryid,calls,total_exec_time,rows,shared_blks_hit,shared_blks_read,temp_blks_read,temp_blks_written,total_plan_time,wal_records,wal_bytes,query
3d8,Synced Era+History INSERTs,,-7352983685246852552,1,554.4719580000001,10000,208544,6,0,0,0,99926,10139630,"INSERT INTO child_era_history_sync (id, valid_range, parent_id, description) SELECT i, daterange('2015-01-01', 'infinity', '[)'), i, 'Shop ' || i FROM generate_series(1, 10000) i"
541,Synced Era+History INSERTs,,6763169388718711347,1,296.473459,10000,138748,5,0,0,0,70068,7305708,"INSERT INTO parent_era_history_sync (id, valid_range, name) SELECT i, daterange('2015-01-01', 'infinity', '[)'), 'Company ' || i FROM generate_series(1, 10000) i"
277,Synced Era+History Update deferred,,86501139974671118,1,550.300291,10000,330954,0,0,0,0,90371,8763725,"UPDATE parent_era_history_sync     SET valid_range = daterange(lower(valid_range), '2016-01-01', '[)')     WHERE id <= 10000 AND lower(valid_range) = '2015-01-01'"
3fc,Synced Era+History Update deferred,,-149447205801887875,1,351.984459,10000,150566,0,0,0,0,60632,7223506,"INSERT INTO parent_era_history_sync (id, valid_range, name)     SELECT id, daterange('2016-01-01', 'infinity', '[)'), name     FROM parent_era_history_sync     WHERE upper(valid_range) = '2016-01-01'"
099,Synced Era+History Update deferred,,-7510143091274267800,1,202.137,0,120108,0,0,0,0,10000,540000,SET CONSTRAINTS ALL IMMEDIATE
19b,Synced Era+History Update non-key,,8828169967120840706,1,951.378834,20000,705382,0,0,0,0,181088,17527063,UPDATE parent_era_history_sync SET name = 'New ' || name WHERE id <= 10000
